Section,Title,Date
Business,"General Motors plans 8,000 new tech hires to power EV goals","January 26, 2022"
Business,"Tesla shares jump ahead of report; investors eye factories, Cybertruck","January 26, 2022"
Markets,LIVE MARKETS When does tech look attractive again?,"January 26, 2022"
Markets,LIVE MARKETS Positioning bingo,"January 26, 2022"
Technology,"Apple poised for strong earnings despite supply constraints, Omicron","January 26, 2022"
Markets,LIVE MARKETS London FX trading falls from records,"January 26, 2022"
Markets,"LIVE MARKETS STOXX rallies, travel stocks fly","January 26, 2022"
Markets,"LIVE MARKETS No time to waver, Chair Powell","January 26, 2022"
Markets,"Morning Bid: No time to waver, Chair Powell","January 26, 2022"
World,U.S. House speaker Pelosi's stock trades attract growing following online,"January 26, 2022"
Technology,U.S. seeks more information from Tesla on distracted drive game probe,"January 26, 2022"
Business,"GM's $7 billion investment intensifies EV battle with Ford, Tesla","January 26, 2022"
Macro Matters,"White House to host GM, Ford among CEOs at meeting on spending push","January 25, 2022"
Focus,Focus: Ford aims to be the Tesla of connected commercial vehicles,"January 25, 2022"
Business,"LG Energy Solution, GM to build $2.1 billion battery factory in U.S.","January 25, 2022"
Business,Hyundai Motor expects vehicle production to rebound in H1 as chip supply improves,"January 25, 2022"
Disrupted,Volkswagen and Bosch team up on automated driving software,"January 25, 2022"
European Markets,The Cryptoverse: Teenage bitcoin throws an interest rate tantrum,"January 25, 2022"
Business,"Cybertrucks, new factories in focus as Tesla set to report record earnings","January 25, 2022"
Technology,"Moody's expects Tesla to stay at EV leader spot, upgrades to 'Ba1'","January 25, 2022"
Legal,"Tesla countersues JPMorgan, claims bank sought 'windfall' after Musk tweet","January 24, 2022"
Markets,LIVE MARKETS Six reasons to buy UK stocks,"January 24, 2022"
Markets,LIVE MARKETS The Fed and the dollar downside risks,"January 24, 2022"
Markets,LIVE MARKETS Many shades of market stress,"January 24, 2022"
Technology,Panasonic to invest $700 million to produce Tesla EV battery -Nikkei,"January 24, 2022"
Markets,LIVE MARKETS Telco M&A fights the gloom,"January 24, 2022"
Markets,Morning Bid: Bears at the gate,"January 24, 2022"
Markets,LIVE MARKETS Bears at the gate,"January 24, 2022"
Markets,"S&P 500, Nasdaq post worst weeks since pandemic start as Netflix woes deepen slide","January 22, 2022"
Business,LIVE MARKETS Baby and bath water both tossed,"January 21, 2022"
Markets,LIVE MARKETS Individual investors keep a watchful eye on inflation,"January 21, 2022"
Markets,"LIVE MARKETS After Netflix's big disappointment, what next?","January 21, 2022"
Markets,Twitter says two security team leaders leaving company,"January 21, 2022"
Technology,Single stock options worth $1.2 trillion set to expire - Options Solutions,"January 21, 2022"
Business,New Zealand water ship unloads in Tonga as other aid trickles in,"January 21, 2022"
World,LIVE MARKETS Value beats growth in biggest gap in almost 2 decades,"January 21, 2022"
Markets,LIVE MARKETS A disruptive Fed?,"January 21, 2022"
Markets,LIVE MARKETS Short-selling 2021 highlights,"January 21, 2022"
Markets,Sony seeks new partners for transformative EV project -executive,"January 21, 2022"
Technology,Nonprofit groups to rate U.S. vehicle driver monitoring systems,"January 21, 2022"
Business,Self-driving sensor maker Luminar shares rally on Mercedes-Benz tie-up,"January 20, 2022"
Business,Mercedes-Benz teams up with Luminar on self-driving tech,"January 20, 2022"
World,U.S. lawmakers call Tesla expansion in Xinjiang 'misguided',"January 20, 2022"
Markets,Tesla Berlin factory to elect works council on Feb 28,"January 20, 2022"
Markets,"India, Tesla in 'weird stalemate' on tax cut demands with no investment pledge-sources","January 20, 2022"
World,"Wall Street sell-off deepens, Nasdaq confirms correction","January 20, 2022"
Technology,Nasdaq confirms fourth correction since pandemic hit,"January 20, 2022"
Business,India's Maharashtra state bats for Tesla over import tax on EVs,"January 19, 2022"
Macro Matters,Retail investors show signs of fatigue after last year's trading frenzy - report,"January 19, 2022"
World,S.Korea's LG Energy Solution sees record retail demand for IPO,"January 19, 2022"
Business,Focus: Cadence Design Systems aims to cash in on new custom-chip era,"January 19, 2022"
Markets,Bitcoin investors dig in for long haul in 'staggering' shift,"January 18, 2022"
Markets,Tesla investors urge judge to order Musk repay $13 bln for SolarCity deal,"January 18, 2022"
Disrupted,Volkswagen and Bosch team up to boost Europe's battery ambitions,"January 18, 2022"
Future of Money,"After flying start, Stellantis must tackle Tesla and China","January 18, 2022"
Business,Tesla CEO Elon Musk to visit Berlin factory in mid February,"January 18, 2022"
Business,The Exchange: Xpeng boldly goes,"January 18, 2022"
Markets,"Reliance, Ola Electric, Mahindra bid for incentives under India's battery scheme","January 15, 2022"
World,NHTSA evaluating potential safety concerns related to heating issue of Tesla cars,"January 14, 2022"
Technology,Volkswagen open to giving away majority in battery division-board member,"January 14, 2022"
Business,"Gen Z investors shift focus from 'meme-stocks' to the 'metaverse,' report shows","January 14, 2022"
Future of Money,Musk says Tesla to accept dogecoin for merchandise,"January 14, 2022"
Future of Money,LG Energy Solution raises $10.8 bln in S.Korea's biggest IPO,"January 14, 2022"
Markets,Dogecoin jumps after Musk tweets Tesla merchandise 'buyable' with the token,"January 14, 2022"
Future of Money,LG Energy Solution's IPO attracts around $80 bln bids from international investors - sources,"January 14, 2022"
Business,Exclusive: Tesla delays initial production of Cybertruck to early 2023 - source,"January 14, 2022"
Disrupted,S.Korea's LG Energy Solution plans U.S. battery JV with Honda -report,"January 14, 2022"
Business,Canada opens probe into Tesla's heating system following consumer complaints,"January 14, 2022"
Business,Delaware Chancery Court Judge Joseph Slights III set to retire,"January 13, 2022"
Legal,"LIVE MARKETS Nasdaq, tech lead market selloff","January 13, 2022"
Markets,Ford crosses $100 bln in market value for the first time,"January 13, 2022"
Business,LIVE MARKETS Earnings season to start Friday as banks go first,"January 13, 2022"
Markets,LIVE MARKETS Megacap growth tumbles as value shares advance,"January 13, 2022"
Markets,"Spring Free EV, Cox partner to supply used EVs to small businesses","January 13, 2022"
Legal,"Senate committee advances Biden's USPTO, Federal Circuit picks","January 13, 2022"
Business,Court rejects Tesla push to reinstate higher U.S. fuel economy penalties,"January 13, 2022"
Markets,LIVE MARKETS Retail investors pile into stocks at record levels,"January 13, 2022"
Markets,Tesla's Musk says 'working through challenges' with India government,"January 13, 2022"
Markets,Wall Street closes higher as inflation data supports Fed bets,"January 13, 2022"
Technology,California reviews whether Tesla's self-driving tests require regulatory oversight,"January 12, 2022"
Business,"After Exxon win, Engine No. 1 turns to diversity, workforce issues","January 12, 2022"
Business,Mercedes-Benz to assemble flagship electric sedan in India,"January 12, 2022"
Markets,Time to buy: Retail investors swoop in when stocks falter,"January 12, 2022"
Business,China's annual auto sales climb for first time since 2017,"January 12, 2022"
Business,"Australia's Liontown signs supply deal with S.Korea's LG Chem, shares jump","January 12, 2022"
Markets,"Tesla sold a record 70,847 China-made vehicles in Dec -CPCA","January 11, 2022"
Markets,Midsize law firm Michelman & Robinson bets on Texas with Dallas office,"January 11, 2022"
Technology,Volkswagen aims to double electric car sales in China this year after missing targets,"January 11, 2022"
Markets,LG revs up Asia’s green-car capital engine,"January 11, 2022"
Markets,Nasdaq ekes out gain in late session comeback,"January 11, 2022"
Business,Tesla signs deal for first U.S. nickel supply with Talon Metals,"January 10, 2022"
Markets,LIVE MARKETS Nasdaq stages a big comeback,"January 10, 2022"
Markets,Wall Street closes lower with Nasdaq staging late session comeback,"January 10, 2022"
Markets,Wall Street tumbles with Nasdaq leading declines,"January 10, 2022"
Markets,LIVE MARKETS S&P 500 Q4 EPS expected to grow 20%,"January 10, 2022"
Markets,Wall Street tumbles as tech stocks extend slide,"January 10, 2022"
Markets,LIVE MARKETS Tech selloff clobbers Cathie Wood's Ark Innovation ETF,"January 10, 2022"
European Markets,"Focus: Forget shareholder resolutions, fund manager says: hire better directors","January 10, 2022"
Markets,"Ahead of IPO, S.Korea's LG Energy Solution flags market share, profit ambitions","January 10, 2022"
Markets,"Tesla raises Full Self Driving software price to $12,000 in U.S., Musk says","January 8, 2022"
Markets,Wall St Week Ahead Hawkish Fed gives value stocks a second wind,"January 7, 2022"
Markets,Wall St mixed after soft jobs data; banks rally,"January 7, 2022"
Technology,"Focus: At CES, tech alliances firm up in the self-driving car wars","January 7, 2022"
Markets,Rivian stock skids as legacy automakers rev up EV targets,"January 6, 2022"
Business,U.S. hybrid electric car sales hit record highs,"January 6, 2022"
Markets,"LIVE MARKETS Major U.S. indexes end red, but banks on fire","January 6, 2022"
Breakingviews,Moderna’s boosted valuation has Tesla-like spin,"January 6, 2022"
Markets,"LIVE MARKETS Omicron hurting spending, for now","January 6, 2022"
Markets,"S&P 500, Nasdaq gain in choppy trading; cyclicals rise","January 6, 2022"
Markets,"LIVE MARKETS Goodbye Tina, don't slam the door on your way out as Fed era ends","January 6, 2022"
Markets,LIVE MARKETS Thursday data: How big an economic party-pooper is Omicron?,"January 6, 2022"
Markets,LIVE MARKETS U.S. stocks quickly turn heavy,"January 6, 2022"
European Markets,Analysis: Jumping on EV wagon represents risky ride for tech pioneer Sony,"January 6, 2022"
Markets,"LIVE MARKETS AMD, Tesla, Nvidia most popular retail picks in latest week","January 6, 2022"
Markets,LIVE MARKETS FANGs look fragile,"January 6, 2022"
Markets,Vietnam car maker VinFast to build U.S. battery factory as it goes all-electric,"January 6, 2022"
Markets,"Column: Still dancing to mega tech's beat, markets wary of tech tantrum: McGeever","January 6, 2022"
World,Russian businessman pleads not guilty in U.S. to insider trading through hacking,"January 6, 2022"
Disrupted,Electric cars hit 65% of Norway sales as Tesla grabs overall pole,"January 6, 2022"
Markets,Factbox: U.S. automakers line up EV models to take on Tesla,"January 5, 2022"
Technology,"Focus: GM to chase Ford, Rivian with a $105,000 electric Silverado pickup","January 5, 2022"
Markets,Ford posts 7% fall in 2021 U.S. auto sales,"January 5, 2022"
Markets,"GM's electric commercial vehicle unit signs deals with Walmart, FedEx","January 5, 2022"
Analysis,Analysis: Some investors turn cautious on Big Tech as Fed hikes loom,"January 5, 2022"
Breakingviews,Beyond Meat’s faux chicken has investors drooling,"January 5, 2022"
Legal,Nikola drops $2 bln patent lawsuit against Tesla over truck design,"January 5, 2022"
Deals,"Amazon and Stellantis partner to deploy smarter cars, cleaner vans","January 5, 2022"
Markets,"EXCLUSIVE Walmart arm did not deliberately remove Xinjiang goods, China exec tells analysts","January 5, 2022"
Business,Startup ONE says battery prototype delivered 750-mile range,"January 5, 2022"
Disrupted,Sony looks to electric cars for its next big hit,"January 5, 2022"
Disrupted,Chinese EV startups turn to Nvidia in the race to catch Tesla,"January 5, 2022"
Technology,"Dow posts closing record high for 2nd day, boosted by banks","January 4, 2022"
Markets,Tesla showroom in China's Xinjiang region blasted by rights groups,"January 4, 2022"
World,"Apple retreats again, after valuation tops $3 trillion again","January 4, 2022"
Markets,"LIVE MARKETS Value train chugs, growth cars derailed","January 4, 2022"
Markets,Wall Street pares risk-taking but stays bullish,"January 4, 2022"
Markets,"Nasdaq, S&P 500 fall with growth shares; banks boost Dow","January 4, 2022"
Markets,Four Delaware rulings from 2021 that could shape M&A litigation,"January 4, 2022"
Legal,"Ford, GM shares jump as electric truck battle heats up","January 4, 2022"
Technology,"Qualcomm inks car chip deals with Volvo, Honda and Renault","January 4, 2022"
Business,"Banks power Dow to record peak; Tech drags S&P 500, Nasdaq lower","January 4, 2022"
Markets,LIVE MARKETS Good news - January is a strong month for equity inflows,"January 4, 2022"
Markets,Explainer: How Tesla weathered global supply chain issues that knocked rivals,"January 4, 2022"
Explainer,LIVE MARKETS On the way to Apple's $3 trln market cap: lots of buybacks,"January 4, 2022"
Markets,LIVE MARKETS New year kicks off with a bang,"January 4, 2022"
Markets,"LIVE MARKETS PMI, JOLTS: Is the economy changing its tune?","January 4, 2022"
Markets,LIVE MARKETS 2021's swagger signals 2022 strength,"January 4, 2022"
Markets,"LIVE MARKETS U.S. stocks mixed, but clear tilt in favor of value","January 4, 2022"
Markets,LIVE MARKETS Nasdaq Composite: Healthier gut,"January 4, 2022"
Markets,Asian stocks track Wall St higher in upbeat start to 2022,"January 4, 2022"
Markets,Asian stocks hold strong in upbeat start to 2022,"January 4, 2022"
Markets,"Apple becomes first company to hit $3 trillion market value, then slips","January 4, 2022"
Technology,Wall Street downplays worries in wishful start to 2022,"January 4, 2022"
Markets,Nio’s European road trip will earn bragging rights,"January 4, 2022"
Markets,Tesla's bumper delivery numbers charge up shares,"January 4, 2022"
Markets,"S&P 500, Dow hit record highs on 1st trading day of 2022","January 4, 2022"
Breakingviews,Wall St gains on first trading day of 2022; Apple hits $3 trln market cap,"January 3, 2022"
Markets,LIVE MARKETS How about that Apple?,"January 3, 2022"
Markets,Wall St rises on 1st trading day of 2022; Apple hits $3 trln market cap,"January 3, 2022"
Markets,Wall Street climbs in upbeat start to 2022,"January 3, 2022"
Business,Tesla surmounts supply chain woes with blockbuster Q4 deliveries,"January 3, 2022"
Technology,"Apple’s $3 trillion market value follows 5,800% gain since iPhone debut","January 3, 2022"
Markets,LIVE MARKETS Most active stock fund managers failed to beat indexes last year,"January 3, 2022"
Markets,Toyota to launch its own automotive software platform by 2025 - Nikkei,"January 3, 2022"
Business,LIVE MARKETS Dollar to extend gains this year as Fed readies rate hikes,"January 3, 2022"
Markets,"Mercedes-Benz unveils 1,000 km-per-charge VISION EQXX prototype","January 3, 2022"
Markets,European stocks kick off 2022 at record highs,"January 3, 2022"
Markets,LIVE MARKETS What a year! Now what?,"January 3, 2022"
Disrupted,"LIVE MARKETS 2022 saunters in like a lamb: Markit, construction outlays","January 3, 2022"
Markets,Sprightly European stocks greet new year by hitting record high,"January 3, 2022"
Markets,"LIVE MARKETS As yields rise, U.S. stocks struggle to hold gains","January 3, 2022"
Business,LG Energy Solution opens books for South Korea's largest IPO at up to $10.8 bln,"January 3, 2022"
Markets,China to cut new energy vehicle subsidies by 30% in 2022,"January 1, 2022"
Business,"Global Markets in 2021: Recoveries, reflation and wrecking balls","December 31, 2021"
World,"Wall Street slips in choppy trade, set to clock robust yearly gains","December 31, 2021"
Markets,China's Tencent builds stake in UK digital bank Monzo,"December 31, 2021"
Markets,"Northvolt battery plant sparks into life, a first for Europe","December 31, 2021"
Markets,Companies will take breakup pitch too far in 2022,"December 31, 2021"
Technology,Tesla recalls almost half a million electric cars over safety issues,"December 31, 2021"
Breakingviews,Tesla recalls some model 3 and model S vehicles in China,"December 31, 2021"
Business,What our columnists got right and wrong in 2021,"December 31, 2021"
Business,"Law firms went West, headed South in 2021 to find new markets","December 30, 2021"
Markets,Four Delaware M&A litigation issues lawyers are watching in 2022,"December 30, 2021"
Legal,"YEARENDER The Year of the Doge? 2021, crypto's wildest year yet","December 30, 2021"
Legal,Breakingviews readers’ top picks for 2021,"December 30, 2021"
U.S. Markets,Tesla's Musk exercises all of his stock options expiring next year,"December 30, 2021"
Markets,Elon Musk's SpaceX raises over $337 mln in fresh funding,"December 29, 2021"
Markets,Analysis: Financial literacy or luck? The year small-time traders made a big impact,"December 29, 2021"
Analysis,Factbox: Tesla's Musk sells shares worth more than $16 bln,"December 29, 2021"
Markets,Analysis: Financial literacy or luck? The year small-time traders made a big impact,"December 28, 2021"
Business,Chinese citizens slam Musk online after space station near-misses,"December 28, 2021"
Analysis,China urges U.S. to act responsibly in space,"December 28, 2021"
Markets,S&P 500 scores record high on retail sales cheer,"December 28, 2021"
Markets,S&P 500 set to end at record high on retail sales cheer,"December 27, 2021"
Markets,Asset bubbles? Champagne outfizzes Big Tech and bitcoin in 2021,"December 24, 2021"
China,"Daimler, BYD to restructure China EV venture Denza","December 24, 2021"
Lifestyle,S&P 500 hits record close as Omicron fears ebb,"December 24, 2021"
Markets,Biden administration offers $1 bln loan guarantee for hydrogen project,"December 24, 2021"
Markets,Tesla pulls games on moving car screens after U.S. safety probe,"December 23, 2021"
Analysis,Analysis: How 2021 became the year of ESG investing,"December 23, 2021"
Markets,Wall Street climbs for third day as Omicron fears ebb,"December 23, 2021"
Markets,Elon Musk: I'm almost done with Tesla stock sales,"December 23, 2021"
Deals,Tencent hands shareholders $16.4 bln windfall in the form of JD.com stake,"December 23, 2021"
Markets,Analysis: U.S. stock market investors wonder how much gas is left in the 2021 rally,"December 23, 2021"
Markets,"Wall St mints strong gains on rosy economic data, encouraging Omicron update","December 23, 2021"
Business,Australia's Syrah Resources soars on graphite supply deal with Tesla,"December 23, 2021"
Markets,"U.S. opens investigation into 580,000 Tesla vehicles over game feature","December 22, 2021"
Analysis,"Wall St rises on rosy economic data, encouraging Omicron update","December 22, 2021"
Markets,"Wall St gains on upbeat economic data, encouraging Omicron update","December 22, 2021"
Markets,Focus: U.S. faces tough choices in 2022 on mines for electric-vehicle metals,"December 22, 2021"
World,"Wall St climbs on positive economic data, Omicron update","December 22, 2021"
Markets,"Wood's flagship ARK fund deep in the red, yet investors stay loyal","December 22, 2021"
Markets,"Tesla, authorities submit documents for German plant approval","December 22, 2021"
Markets,Combustion engines are carmakers’ toxic assets,"December 22, 2021"
Markets,"RPT-Global Markets in 2021: Recoveries, reflation and wrecking balls","December 22, 2021"
Breakingviews,Musk's SpaceX hit by 132 COVID-19 cases,"December 21, 2021"
Markets,"Factbox: New U.S. tailpipe emissions rules: more efficient vehicles, more congestion","December 21, 2021"
World,"Wall Street bounces from Omicron selloff as Nike, Micron lead gains","December 21, 2021"
Markets,Group says Tesla Model Y 'Top Safety Pick',"December 21, 2021"
Markets,"'Has anyone seen Web3?' Musk, Dorsey mock tech's latest buzzword","December 21, 2021"
Markets,Booze to batteries will measure China’s transition,"December 21, 2021"
Business,"Russian businessman, others made millions in insider trading through hacking -U.S.","December 20, 2021"
Markets,"Wall Street skids on Omicron worry, obstacle to Biden social-spending package","December 20, 2021"
Breakingviews,"From metaverse to DAOs, a guide to 2021's tech buzzwords","December 20, 2021"
World,Big Meat will channel VW-Tesla in alt-protein war,"December 20, 2021"
Markets,Tesla's Musk says he will pay over $11 bln in taxes this year,"December 20, 2021"
Markets,Biden electric vehicle push hits setback in U.S Senate,"December 19, 2021"
Markets,Wall St Week Ahead Narrowing market breadth may be worrying signal for stocks,"December 19, 2021"
Markets,Wall St Week Ahead Narrowing market breadth may be worrying signal for stocks,"December 18, 2021"
Autos & Transportation,"Rivian warns supply issues to hit production, shares drop to record low","December 18, 2021"
Markets,Tesla faces investor lawsuit over Musk tweets on 10% stock sales,"December 18, 2021"
Markets,LIVE MARKETS Wall Street ends downer week singing rate hike blues,"December 17, 2021"
Markets,"China's Huayou agrees lithium production, battery recycling tie-up","December 17, 2021"
Markets,Focus: Batteries included? Northvolt goes all out to meet 2021 launch goal,"December 17, 2021"
Disrupted,Nasdaq closes sharply lower as investors dump growth stocks,"December 17, 2021"
Markets,"EV startup Rivian to build $5 bln plant in Georgia, posts quarterly loss","December 17, 2021"
Markets,Paris crash Tesla driver says car accelerated on its own - lawyer,"December 16, 2021"
World,U.S. auto safety nominee seeks to finish probes of Tesla crashes,"December 16, 2021"
Business,Nasdaq ends sharply lower as investors dump growth stocks,"December 16, 2021"
Markets,"Dow up as cyclicals gain; Nasdaq, S&P 500 fall on tech weakness","December 16, 2021"
Markets,Musk says Tesla's Texas factory is $10 bln investment over time,"December 16, 2021"
Technology,Wall Street set to rise as Fed wages war on inflation,"December 16, 2021"
Markets,Tesla told France there was no sign of technical fault in Paris crash,"December 16, 2021"
Markets,Driver of Tesla involved in Paris accident under formal investigation - BFM TV,"December 15, 2021"
Business,Biden auto safety nominee vows to address jump in traffic deaths,"December 15, 2021"
Markets,Wall Street falls ahead of Fed announcement,"December 15, 2021"
World,"Runaway Tesla left trail of destruction in central Paris, say witnesses","December 15, 2021"
U.S. Markets,"Coinbase says connectivity issues fixed, investigating delays","December 15, 2021"
Business,"China EV, battery makers grapple with graphite squeeze","December 15, 2021"
Business,Paris taxi firm suspends use of Tesla cars after fatal accident,"December 15, 2021"
Analysis,Analysis: LG Energy Solution's IPO likely to be priced at $11 bln top end - sources,"December 15, 2021"
Business,FT names Elon Musk as its 'person of the year',"December 15, 2021"
Business,"Toyota commits $70 bln to bolster electrification, shares rally","December 15, 2021"
Business,Wall St tumbles on hot producer prices data as Fed meet looms,"December 15, 2021"
Markets,Wall Street drops as investors eye inflation and coronavirus,"December 14, 2021"
Markets,"Tesla to accept dogecoin as payment for merchandise, says Musk","December 14, 2021"
U.S. Markets,LIVE MARKETS Who's breathing down the BoE's neck?,"December 14, 2021"
Markets,EV ride-hail leasing company Hive raises $30 mln in funding round,"December 14, 2021"
Markets,LIVE MARKETS M&A drag,"December 14, 2021"
Markets,"LIVE MARKETS ""Equity bullishness is alive and well""","December 14, 2021"
Markets,LIVE MARKETS STOXX bounces from 1-week low,"December 14, 2021"
Markets,LIVE MARKETS Big Apple,"December 14, 2021"
Markets,Big Apple,"December 14, 2021"
Markets,Apple closes in on $3 trillion market value,"December 14, 2021"
Markets,Musk sells Tesla shares worth $906.5 million - filings,"December 14, 2021"
Business,California proposes cutting major rooftop solar incentive after years of debate,"December 13, 2021"
Business,Elon Musk named Time's 2021 'Person of the Year',"December 13, 2021"
Markets,LIVE MARKETS Wall Street turns red ahead of Fed,"December 13, 2021"
Markets,LIVE MARKETS Dividend stocks: Stability in an unstable market,"December 13, 2021"
Markets,U.S. Senate panel to hold hearing on Biden auto-safety agency pick,"December 13, 2021"
Markets,"LIVE MARKETS Geopolitics 2022: ""managed disagreements""","December 13, 2021"
Markets,Apple inches closer to $3 trillion market value,"December 13, 2021"
Markets,LIVE MARKETS The champagne's gone flat: World business sentiment turns gloomy,"December 13, 2021"
Markets,LIVE MARKETS Too early to estimate Tornado insurance claims,"December 13, 2021"
Markets,LIVE MARKETS Wall Street hits the slopes after hint of a lift,"December 13, 2021"
Markets,LIVE MARKETS Don't fret over the narrowing breadth,"December 13, 2021"
Markets,"Volkswagen, Bosch to cooperate on automotive software - Handelsblatt","December 11, 2021"
Markets,Ford expects to triple electric Mustang output by 2023,"December 11, 2021"
Markets,"Wall St gains, S&P hits record closing high as CPI meets expectations","December 11, 2021"
Business,Tesla's Elon Musk says he is 'thinking of quitting' his jobs,"December 10, 2021"
Markets,"Wall Street gains, S&P hits record closing high as CPI meets expectations","December 10, 2021"
Business,Tesla stops taking new orders for flagship models outside North America -Electrek,"December 10, 2021"
Markets,"Daimler Truck spin-off already unlocking value, Daimler CEO says","December 10, 2021"
Markets,"Tesla sued by second female worker over sexual harassment, retaliation","December 10, 2021"
