Section,Title,Date
Markets,"Wall Street extends rally, powered by tech bounce","January 24, 2023"
Business,California accounted for 40% of U.S. zero-emission vehicle sales in 2022,"January 23, 2023"
Business,"Ford to cut up to 3,200 European jobs, union says, vowing to fight","January 23, 2023"
Legal,Elon Musk retakes the witness stand in Tesla 'funding secured' trial,"January 23, 2023"
Charged,Exclusive: Geely plans to turn maker of London black cabs into EV powerhouse,"January 23, 2023"
Business,Comment: Why China’s car makers are streets ahead in race to develop electric vehicles,"January 23, 2023"
Business,Take Five: Staring at the ceiling,"January 23, 2023"
Charged,Focus: New suppliers race to plug in to electric car market,"January 23, 2023"
Markets,Wall St Week Ahead Tech stock rebound faces doubters with earnings season ahead,"January 22, 2023"
Legal,"Musk to jury: Just because I tweet something, doesn't mean people believe it","January 21, 2023"
Business,Tesla pushes back Model 3 delivery times in Germany after price cuts,"January 20, 2023"
Charged,Analysis: Tesla's price cuts promise more pain for money-losing U.S. EV startups,"January 20, 2023"
Markets,Column: U.S. manufacturing has probably entered recession: Kemp,"January 20, 2023"
Charged,Analysis: Tesla uses its profits as a weapon in an EV price war,"January 20, 2023"
Autos & Transportation,"Tesla's Gruenheide plant should ramp up output, local minister says","January 20, 2023"
Markets,"Ark's Wood remains bullish on Tesla, says oil stock rally 'defying logic'","January 19, 2023"
Charged,Vietnam EV maker VinFast plans promotions in response to Tesla price cuts,"January 19, 2023"
Deals,"Indonesia says BASF, Eramet near $2.6 bln deal to process nickel for EV batteries","January 19, 2023"
Legal,"Grilling Musk: use CEO's tweets, thin skin against him, trial experts say","January 19, 2023"
Legal,Musk trial: lawyers clash over whether CEO lied in 2018 Tesla tweet,"January 19, 2023"
Business,"Renault group sales fall 5.9% in 2022, Europe order book at record levels","January 18, 2023"
Breakingviews,"China’s demographic decline can be boon, not doom","January 18, 2023"
Charged,Focus: China's BYD takes cautious approach to U.S. in global EV push,"January 18, 2023"
Technology,"Tesla video promoting self-driving was staged, engineer testifies","January 18, 2023"
Business,Tesla's retail sales in China surged after price cut -brokerage data,"January 18, 2023"
Legal,Jury seated in Tesla shareholder case over Musk's 2018 tweets,"January 18, 2023"
Markets,"Goldman, Travelers drag Dow lower as earnings season picks up","January 18, 2023"
Markets,Morning Bid: BOJ's moment of truth,"January 17, 2023"
Charged,"Hertz to offer 25,000 EV rentals to Uber drivers in Europe","January 17, 2023"
Business,Renault sales fall for 4th straight year,"January 17, 2023"
Autos & Transportation,"Chinese EV maker Xpeng joins Tesla, Seres in price cuts","January 17, 2023"
Charged,Indonesia close to EV deals with BYD Group and Tesla - minister,"January 17, 2023"
Business,"Tesla under fire in Germany over union concerns on working hours, contracts","January 16, 2023"
Markets,"S&P 500 ends at highest in month, indexes gain for week as earnings kick off","January 14, 2023"
Autos & Transportation,Tesla turns up heat on rivals with global price cuts,"January 13, 2023"
Legal,Prospective jurors don't like Elon Musk. Just ask his own lawyers.,"January 13, 2023"
Legal,Musk bets big on beating shareholders at 'funding secured' trial,"January 13, 2023"
Markets,Morning Bid: Money in the bank,"January 13, 2023"
Business,"Tesla: we are making Model Y, Model 3 more accessible to customers","January 13, 2023"
Charged,Exclusive: Chinese EV maker BYD to build Vietnam component plant - sources,"January 13, 2023"
Charged,"Huawei-backed Aito cuts prices in China, following Tesla","January 13, 2023"
Markets,Wall St ends up as data suggests inflation may be on downward trend,"January 13, 2023"
Legal,"Apple, Google ask appeals court for another chance to nix patent rule","January 12, 2023"
Business,Tesla delays plans to expand Shanghai factory - Bloomberg News,"January 12, 2023"
Business,Tesla nears deal to build production facilities in Indonesia -Bloomberg News,"January 12, 2023"
Business,Indonesia says investment talks with Tesla still ongoing,"January 12, 2023"
Macro Matters,"China's exports seen cooling further in December on weak global demand, COVID woes: Reuters poll","January 12, 2023"
Legal,Tesla investors argue Musk can receive fair 'funding secured' trial in San Francisco,"January 12, 2023"
Legal,Judge rejects Tesla's challenge to Calif. agency in race bias lawsuit,"January 11, 2023"
Business,Brand Watch: 2023 will be a year that separates the bona fide from the bogus on sustainability pledges,"January 11, 2023"
World,U.S. agency plans to propose new fuel economy standards in April,"January 11, 2023"
Charged,Tesla files for $776 mln expansion of Texas gigafactory,"January 11, 2023"
Technology,"German chancellor meets auto, battery bosses in 'mobility' summit","January 10, 2023"
Autos & Transportation,Protesting Tesla China buyers vow more pressure over price cuts they missed,"January 10, 2023"
Business,"China passenger vehicle sales rise in Dec, Tesla sales slump 41% - data","January 10, 2023"
Markets,S&P 500 near flat as investors weigh chances of less aggressive rate hikes,"January 10, 2023"
Business,BMW teases a talking car that shifts colors like a chameleon,"January 9, 2023"
Technology,"'Extensive' Tesla Autopilot probe proceeding 'really fast', U.S. official says","January 9, 2023"
Charged,Waiting times for some Tesla models in China increase after automaker discounts,"January 9, 2023"
Business,GM wants U.S. Treasury to reconsider tax credits for Cadillac Lyriq EV,"January 9, 2023"
Business,U.S. asks Tesla about Musk tweet on driver monitoring function,"January 9, 2023"
World at Work,Disney asks employees to work from office four days a week - CNBC,"January 9, 2023"
Business,Got game? Automakers show off in-car entertainment options at CES,"January 9, 2023"
Business,Taiwanese satellites signal Asia’s distrust of Musk,"January 9, 2023"
Breakingviews,Tesla offers discount in Singapore on EVs in inventory,"January 9, 2023"
Charged,Tesla owners in China protest against surprise price cuts they missed,"January 7, 2023"
Charged,"Tesla slashes prices in China, other Asian markets as sales stumble","January 7, 2023"
Charged,Tesla short sellers pile on pressure after most profitable trade in 2022,"January 6, 2023"
Markets,Germany tells Musk it expects Twitter to fight disinformation,"January 6, 2023"
Technology,Prices of some Tesla models cut in South Korea -official,"January 6, 2023"
Technology,"South Korea's SK On plans a new, lower cost EV battery by 2025","January 6, 2023"
Breakingviews,Chip woes short-circuit Samsung's best laid plans,"January 6, 2023"
World,Michigan Democratic Senator Stabenow will not seek re-election in 2024,"January 6, 2023"
Markets,Wall St drops more than 1% with jobs data feeding fears of more Fed tightening,"January 6, 2023"
Autos & Transportation,"Geely's EV brand Zeekr aims to double sales in 2023, expand in Europe","January 6, 2023"
Charged,Stellantis CEO delivers a technology statement with a Ram truck,"January 6, 2023"
Markets,Amazon: it’s just like them,"January 5, 2023"
Breakingviews,"China has a 10,000 euro cost advantage in small EVs, auto supplier says","January 5, 2023"
Business,Tesla's Dec sales of China-made cars fall to the lowest in five months,"January 5, 2023"
Charged,Stellantis keeps feet on ground in air taxi punt,"January 5, 2023"
Business,"Tesla, EV rivals absorb costs after China pulls plug on subsidy","January 5, 2023"
Breakingviews,Hong Kong’s hamsters sound shrill warning,"January 5, 2023"
Charged,California doctor who drove Tesla off cliff to be charged with attempted murder,"January 5, 2023"
Breakingviews,"With big bets on Musk, these funds may have a Tesla problem in '23","January 5, 2023"
World,More U.S. consumers want EVs but prices are a concern - Deloitte survey,"January 4, 2023"
Business,Elon Musk's Twitter lifts ban on political ads,"January 4, 2023"
Charged,Meta faces exsanguination by small fines,"January 4, 2023"
Breakingviews,Automakers won’t go back to normal,"January 4, 2023"
Charged,Rivian stock less bruised than Tesla as both miss EV targets,"January 4, 2023"
Markets,"Wall St starts the year with a dip; Apple, Tesla shares drag","January 4, 2023"
Markets,"Dollar jumps, U.S. stocks buck global rally","January 3, 2023"
Autos & Transportation,"Tesla shares suffer New Year's hangover on demand worries, delivery issues","January 3, 2023"
Markets,Every picture Tesla story,"January 3, 2023"
Charged,South Korea fines Tesla $2.2 mln for exaggerating driving range of EVs,"January 3, 2023"
Charged,Exclusive: Tesla makes China boss highest-profile executive after Musk,"January 3, 2023"
Charged,Foxconn to use Nvidia chips to build self-driving vehicle platforms,"January 3, 2023"
Breakingviews,Tesla merges into slower lane,"January 3, 2023"
Charged,"Tesla deliveries miss estimates due to logistical issues, slowing demand","January 3, 2023"
Breakingviews,"Foxconn reinvents itself, and EV supply chains","January 3, 2023"
Breakingviews,Being ready for anything is top priority for 2023,"January 3, 2023"
Technology,South Korea fines Tesla $2.2 mln for exaggerating driving range of EVs,"January 3, 2023"
Charged,Tesla in pole position in Norway's race to EV goal,"January 3, 2023"
Business,Tesla's China head Tom Zhu takes over sales in North America- Electrek,"January 3, 2023"
Asian Markets,China December manufacturing contracts sharply as COVID infections soar,"January 2, 2023"
Markets,Wall Street ends 2022 with biggest annual drop since 2008,"December 30, 2022"
Macro Matters,"Inflation, recession and earnings among factors to drive U.S. stocks in 2023","December 30, 2022"
Markets,"How 2022 shocked, rocked and rolled global markets","December 30, 2022"
Disrupted,"Baidu, Pony.ai start driverless robotaxi tests in Beijing","December 30, 2022"
Markets,"Wall St ends firmer, growth stocks lead in thin trading","December 30, 2022"
Business,U.S. Treasury says consumer leases can qualify for EV tax credits,"December 30, 2022"
Charged,Musk tells Tesla workers not to be 'bothered by stock market craziness',"December 29, 2022"
Markets,"U.S. stocks drop on recession fears, Nasdaq closes at new bear market low","December 29, 2022"
Charged,Tesla shares record rare jump this month on the way to worst year,"December 28, 2022"
Legal,"Shareholders v. Tesla, Nasdaq's diversity rule: Securities cases to watch in 2023","December 28, 2022"
Macro Matters,"Inflation, recession and earnings among factors to drive U.S. stocks in 2023","December 28, 2022"
Charged,Tesla shares extend losses on demand worries in China,"December 28, 2022"
Breakingviews,Vietnam’s Elon Musk challenger turns heads in 2023,"December 28, 2022"
Markets,"S&P 500, Nasdaq close lower, weighed by growth stocks","December 28, 2022"
Markets,"Wall St stocks fall, bond yields rise as China drops quarantine rule","December 27, 2022"
Autos & Transportation,"Focus: Tesla used car price bubble pops, weighs on new car demand","December 27, 2022"
Business,"Exclusive: Tesla to run reduced output in Shanghai in January, plan shows","December 27, 2022"
Analysis,Analysis: Wood’s ARK slammed by higher interest rates in 2022 along with other growth funds,"December 27, 2022"
World,"Star rising in Kremlin, Russia's Medvedev predicts war in West","December 27, 2022"
World,"Beijing, Shanghai residents back to work as China limps towards living with COVID","December 26, 2022"
Markets,Wall St Week Ahead Investors look for 'Santa Rally' after grim year in U.S. stocks,"December 25, 2022"
Business,Tesla suspends production at Shanghai plant,"December 24, 2022"
Markets,"Wall Street ends up as investors eye data for rate prospects, energy outperforms","December 24, 2022"
Technology,Elon Musk's vow to not sell more Tesla stock fails to calm investors,"December 23, 2022"
Markets,Morning Bid: Grinch (re)appears,"December 23, 2022"
Charged,Indonesia considers $320 mln in incentives to boost EV sales in 2023,"December 23, 2022"
Charged,Focus: Tesla sends Shanghai boss and aides to jumpstart U.S. output,"December 23, 2022"
Business,Tesla shares tank after U.S. discounts doubled on key models,"December 23, 2022"
Business,Elon Musk says he will not sell more Tesla stock for about two years,"December 23, 2022"
Business,U.S. Senate committee asks carmakers about Chinese supply chain,"December 23, 2022"
Markets,"Wall Street tumbles on rate, recession worries, bleak chipmaker outlook","December 23, 2022"
Business,Twitter seeks dismissal of disability bias lawsuit over job cuts,"December 22, 2022"
Legal,Morning Bid: Season's beatings,"December 22, 2022"
Markets,Analysis: Short sellers gain nearly $304 bln after tumble in U.S. stocks,"December 22, 2022"
Analysis,U.S. safety agency probes two more Tesla crashes involving suspected driver assistance,"December 22, 2022"
Business,"Tesla shares tumble, on track for worst month ever","December 22, 2022"
Business,"How 2022 shocked, rocked and rolled global markets","December 22, 2022"
Markets,Factbox: Tesla's key managers in China,"December 22, 2022"
Business,Tesla driver in multi-car crash told police self-driving software malfunctioned,"December 22, 2022"
Business,Elon Musk expects Twitter to be 'cash flow break-even' next year,"December 21, 2022"
Technology,Musk to step down as Twitter CEO once he finds 'someone foolish' enough as successor,"December 21, 2022"
Business,"Tesla to freeze hiring, lay off employees next quarter - Electrek","December 21, 2022"
Breakingviews,Quiet quitting China will start with the Chinese,"December 21, 2022"
Technology,"Elon Musk, 'Chief Twit'","December 21, 2022"
Markets,Morning Bid: A year in reverse,"December 21, 2022"
Technology,: Musk to step down as Twitter CEO once he finds successor,"December 21, 2022"
World,Corporate China struggles with supply snags as COVID cases spread,"December 21, 2022"
Markets,Wall St closes slightly higher after four-day sell off,"December 21, 2022"
Future of Money,Cryptocurrencies at crossroads after annus horribilis,"December 21, 2022"
Business,Investor in Musk's Twitter buyout expects to make up to five times its money,"December 20, 2022"
Business,Tesla falls on growing angst over Musk's focus on Twitter,"December 20, 2022"
Business,Comment: To plug the green economy data gap we need regulators to mandate climate reporting,"December 20, 2022"
Markets,Wall Street falls fourth straight day as recession worries nag,"December 20, 2022"
Charged,U.S. Treasury will delay EV battery sourcing guidance until March,"December 20, 2022"
World,"Senator Warren, Tesla investor turn up heat over Musk's Twitter role","December 19, 2022"
Legal,"Tesla fired workers for criticizing Musk, company policies, say new complaints","December 19, 2022"
Technology,Musk's poll results: Elon should step down as Twitter CEO,"December 19, 2022"
Business,"Tesla hits 3,000 cars a week in Berlin, Austin later than planned","December 19, 2022"
Business,Tesla may announce $800 mln to $1 bln in Mexico plant in coming days - report,"December 19, 2022"
Technology,Factbox: Elon Musk's Twitter polls - from stake sales to CEO decisions,"December 19, 2022"
Technology,Elon Musk launches poll asking if he should quit as Twitter CEO,"December 19, 2022"
Technology,Elon Musk restores Twitter accounts of journalists but concerns persist,"December 17, 2022"
Technology,"Elon Musk's team seeks new funding for Twitter, investor says","December 17, 2022"
Charged,"Exclusive: PepsiCo to roll out 100 Tesla Semis in 2023, exec says","December 17, 2022"
Business,Tesla plans to announce Mexico EV plant as soon as next week -Bloomberg News,"December 17, 2022"
Markets,Retail investors turn to ETFs as recession fears knock down meme stocks,"December 16, 2022"
Charged,Faraday Future slides on signaling need for funds to start production,"December 16, 2022"
Charged,Electric vehicle production set to surge in 2023 despite low sales,"December 16, 2022"
Business,Musk cashes out another $3.6 bln in Tesla stock,"December 16, 2022"
Business,Italian brake maker Brembo plans expansion in northern Mexico,"December 15, 2022"
Autos & Transportation,Adding EVs to U.S. biofuels law is environmental agency's 2023 task,"December 15, 2022"
Business,"Ford hikes price of cheapest F-150 electric truck variant to nearly $56,000","December 15, 2022"
Business,Brand Watch: CDP’s 'A-list' of climate leaders a reminder of gap between ambition and action,"December 15, 2022"
Markets,Morning Bid: Still a ways to go?,"December 15, 2022"
Markets,"Morning Bid: Thank you, next","December 15, 2022"
Business,Tesla shares fall as investors bash Musk's Twitter focus,"December 15, 2022"
Markets,Wall Street ends lower after latest Fed rate hike,"December 15, 2022"
Legal,Twitter drops law firm criticized by Elon Musk from child exploitation case,"December 15, 2022"
Charged,Tesla to search for water in quest to expand German gigafactory,"December 14, 2022"
Markets,"Exclusive: Musk's banks to book Twitter loan losses, avoid big hits -sources","December 14, 2022"
Charged,Panasonic agrees to supply EV batteries to Lucid Group,"December 13, 2022"
Business,Geely's premium electric car brand Zeekr files for U.S. IPO,"December 13, 2022"
Charged,Focus: German car giants and Asian battery kings: a match made in Hungary,"December 13, 2022"
World,"White House says Musk's condemnation of Fauci is 'dangerous,' 'disgusting'","December 13, 2022"
Business,U.S. auto fleet fuel efficiency flat in 2021 as Detroit Three lag,"December 13, 2022"
Business,"Exclusive: Zeekr, a premium Geely electric car brand, seeks over $1 billion in U.S. IPO - sources","December 12, 2022"
Business,"U.S. finalizes $2.5 billion loan to GM, LG battery joint venture","December 12, 2022"
Charged,Exclusive: Toyota to outline 3-year EV plan changes to suppliers,"December 12, 2022"
Lifestyle,Elton John quits Twitter,"December 9, 2022"
Markets,Recession drumbeat gets louder as more U.S. CEOs strike mellow note for 2023,"December 9, 2022"
Business,Tesla to suspend Model Y output in Shanghai in last week of Dec-memo,"December 9, 2022"
Business,Musk says wise to avoid margin loans during macroeconomic risks,"December 9, 2022"
Legal,Activision sues Calif. agency for records on sex bias lawsuit,"December 8, 2022"
Business,"Tesla to shorten Shanghai shifts, delay hiring - Bloomberg News","December 8, 2022"
Markets,"China Nov passenger vehicle sales drop 9.5%, first fall in six months - CPCA","December 8, 2022"
Business,Elon Musk briefly loses title as world's richest person to LVMH's Arnault - Forbes,"December 8, 2022"
Business,Musk taps Tesla's China chief to run Texas gigafactory - Bloomberg News,"December 8, 2022"
Business,Musk's bankers mull new Tesla margin loans to slash Twitter debt - Bloomberg News,"December 8, 2022"
Markets,"S&P, Nasdaq extend losing streaks amid rising recession worries","December 8, 2022"
World,Ukraine's Zelenskiy named Time's 2022 'Person of the Year',"December 8, 2022"
Legal,Tesla loses bid for new trial in factory worker's race bias case,"December 7, 2022"
Charged,Tesla launches EVs in Thailand amid competition from cheaper brands,"December 7, 2022"
Breakingviews,Vietnam’s Tesla faces daunting Nasdaq road test,"December 7, 2022"
World,Suspicious packages sent to Ukrainian missions came from Germany - Kyiv,"December 7, 2022"
Charged,"Automakers, South Korea urge U.S. to tap commercial EV tax credit","December 7, 2022"
Business,Tesla offers additional discount to Chinese buyers on some models,"December 7, 2022"
Business,Toyota offers cheaper Prius if customers take software updates,"December 7, 2022"
Disrupted,"Exclusive: Musk’s Neuralink faces federal probe, employee backlash over animal tests","December 6, 2022"
Disrupted,"Sony says it has technology for humanoid robots, needs to find usage","December 6, 2022"
Technology,Microsoft mulls building 'super app' - The Information,"December 6, 2022"
Markets,Wall St slides as services data spooks investors about Fed rate hikes,"December 6, 2022"
World,Tax credits for EU electric vehicles dominate U.S. trade talks,"December 5, 2022"
Autos & Transportation,"GM's BrightDrop signs first customer in Canada, unveils country's first large EV factory","December 5, 2022"
Business,Tesla cuts output plan for Shanghai plant for Dec -sources,"December 5, 2022"
Business,Tesla China denies media reports of output cut at Shanghai plant,"December 5, 2022"
Business,"Tesla sold 100,291 China-made vehicles in Nov -Xinhua","December 5, 2022"
Breakingviews,Western firms’ Chinese red lines are not their own,"December 2, 2022"
World at Work,Evergrande's EV unit suspends mass production due to lack of orders - sources,"December 2, 2022"
Charged,"Musk delivers first Tesla truck, but no update on output, pricing","December 2, 2022"
Business,Morgan Stanley making 'modest' job cuts; CEO 'wouldn't bet against' Musk,"December 2, 2022"
Business,U.S. EPA proposes revamp of biofuel program to include electric vehicles,"December 1, 2022"
Disrupted,Elon Musk expects Neuralink's brain chip to begin human trials in 6 months,"December 1, 2022"
Business,"Tesla to issue software updates for 435,000 cars in China over marker light issue","December 1, 2022"
Charged,Musk set to finally take wraps off Tesla truck - to tough crowd,"December 1, 2022"
Markets,China's lithium newcomer Zijin eyes rich returns from battery demand,"December 1, 2022"
Technology,"U.S. EPA to propose boost in biofuel blending volumes, EV program -sources","December 1, 2022"
Business,Wall Street ends sharply higher after Powell comments,"December 1, 2022"
Markets,Elon Musk says Apple never considered removing Twitter from App Store,"December 1, 2022"
Technology,Tesla plans to ramp up Model Y production from Giga Texas in 2023 - Electrek,"November 30, 2022"
Charged,"BYD set to be China's top-selling car brand for Nov, Tesla gains -data","November 30, 2022"
Business,S&P 500 ends down as Apple dips and traders eye Powell speech,"November 30, 2022"
Markets,Twitter blue verified set to launch on Apple's iOS app - Information,"November 30, 2022"
Technology,Musk’s Apple fight could be his Twitter legacy,"November 29, 2022"
Breakingviews,Tesla market share could be dented by cheaper rival EVs - S&P Global Mobility,"November 29, 2022"
Macro Matters,South Korea orders striking truckers in cement industry back to jobs,"November 29, 2022"
Asia Pacific,Elon Musk: Apple threatened to yank Twitter from App Store,"November 29, 2022"
Technology,Exclusive: South Korea's Yoon ready to offer 'tailored' benefits to attract Tesla gigafactory,"November 29, 2022"
Charged,"Wall Street ends down sharply, hit by Apple and China worries","November 29, 2022"
Markets,"China regulator says Tesla recalls more than 80,000 cars","November 28, 2022"
Charged,Exclusive: Tesla readies revamped Model 3 with project 'Highland' -sources,"November 28, 2022"
Charged,"Tesla's Full Self-Driving Beta now available to all in N. America, Musk says","November 24, 2022"
Business,Russia revives Soviet-era Moskvich brand with Chinese model,"November 24, 2022"
Markets,Wall Street rises as Fed signals slowdown in rate hikes,"November 24, 2022"
Charged,Elon Musk names S. Korea among top candidates for EV investment - Yoon's office,"November 23, 2022"
Business,LG Chem to invest over $3 billion to build U.S. battery cathode plant,"November 22, 2022"
Business,Carl Icahn holds short position in GameStop - Bloomberg News,"November 22, 2022"
Markets,Wall Street slips as concerns rise of stricter China COVID curbs,"November 22, 2022"
Charged,"Tesla recalls 321,000 U.S. vehicles over rear light issue","November 21, 2022"
Insight,"Insight: Tesla safety at centre of South Korean trial over fiery, fatal crash","November 21, 2022"
Markets,"Wall St Week Ahead With Black Friday ahead, investors look to U.S. consumer stocks","November 20, 2022"
Business,Musk's pay trial asks if Tesla's growth justifies $56 bln compensation,"November 19, 2022"
Future of Money,FTX founder's remarks pose challenge for his lawyers,"November 18, 2022"
Technology,"Musk says Twitter reinstates banned users Griffin, Peterson; no decision on Trump yet","November 18, 2022"
Business,"Tesla recalls 30,000 Model X cars, shares hit two-year low","November 18, 2022"
Technology,EU's Vestager says Twitter chaos creates opportunity to seek alternatives,"November 18, 2022"
Charged,Ford executive says South Africa needs EV policy within six months,"November 18, 2022"
Technology,"Factbox: Twitter 2.0: Musk warns of bankruptcy, flip-flops on blue check mark in chaotic start","November 18, 2022"
Technology,Factbox: Advertisers react to Twitter's new ownership,"November 18, 2022"
Markets,Australia's OZ Minerals backs BHP's improved $6.5 bln offer,"November 18, 2022"
Markets,Column: LME tightens restraints as nickel turns unruly again,"November 18, 2022"
Legal,"Ex-Girardi Keese CFO spent firm money on home remodeling, escort, affidavit says","November 17, 2022"
Business,"GM promises profitable EVs, with a boost from Washington","November 17, 2022"
Markets,"GM aims to lower EV battery cost, locks up supply deal with Vale","November 17, 2022"
Business,Eight SpaceX employees say they were fired for speaking up against Elon Musk,"November 17, 2022"
Business,"Musk says he made some Tesla decisions without board nod, defends $56 bln pay","November 17, 2022"
Technology,Musk tells Twitter staff: Opt in for 'intensity' or take severance,"November 17, 2022"
