Section,Title,Date
World at Work,UAW union embraces social media as labor talks toughen ahead of deadline,"September 9, 2023"
Legal,Elon Musk's X Corp sues California to undo content moderation law,"September 9, 2023"
Technology,Congress to hold new AI hearings as it works to craft safeguards,"September 8, 2023"
Business,"China car sales return to growth in August, Tesla nearly doubles EV share","September 8, 2023"
Insight,Why Native American tribes struggle to tap billions in clean energy incentives,"September 8, 2023"
Business,China car sales rise 2.2% y/y in Aug,"September 8, 2023"
Charged,Lotus launches electric GT model as mass expansion plan rolls on,"September 8, 2023"
Markets,Russian businessman gets 9 years in US prison for hack-and-trade scheme,"September 7, 2023"
World,"EV, energy storage battery prices set to fall more, report says","September 7, 2023"
Charged,China moves to widen state employee iPhone curbs,"September 7, 2023"
Technology,Investors’ China aversion is bad for everyone,"September 7, 2023"
Breakingviews,Tesla pushes US appeals court to uphold ban on workers' union t-shirts,"September 6, 2023"
Legal,"Tesla suppliers say carmaker expects 2026 or 2027 Mexico production start, Reforma reports","September 6, 2023"
Business,"Elon Musk borrowed $1 billion from SpaceX in same month of Twitter deal, Wall Street Journal reports","September 6, 2023"
Business,EV broken? Finding a technician to fix it may take a while,"September 6, 2023"
Charged,"Cummins, Daimler, PACCAR form joint venture for US battery cell production","September 6, 2023"
Charged,US says 52 million air bag inflators should be recalled over rupture threat,"September 5, 2023"
Business,Tesla sues Chinese firm over tech secret infringement -Chinese state media,"September 5, 2023"
Business,Albemarle aims to close buyout of lithium developer Liontown by mid-2024,"September 5, 2023"
Business,Volkswagen offered temporary discounts in embattled Chinese market,"September 5, 2023"
World at Work,China's auto workers bear the brunt of price war as fallout widens,"September 5, 2023"
Markets,Lithium developer Liontown backs Albemarle's $4.3 billion bid,"September 4, 2023"
Charged,Tesla's China-made EV deliveries rise 9.3% y/y in August,"September 4, 2023"
Technology,"CATL to produce fast-charging Shenxing battery in Germany, Hungary","September 4, 2023"
Business,Tesla China extends delivery time for Model Y Long Range to 6-8 weeks,"September 4, 2023"
Business,"Renault cannot afford discount race with Tesla, Chinese peers, executive says","September 3, 2023"
Business,"BMW expects higher China sales in 2023, finance chief says","September 2, 2023"
Business,Tesla shows off restyled Model 3 sedan at Beijing trade fair,"September 2, 2023"
Charged,"BMW's 'Neue Klasse' at least as profitable as current EVs, CEO says","September 2, 2023"
Charged,Focus: BMW bets on a 'Neue Klasse' revival to catch Tesla,"September 2, 2023"
Markets,S&P 500 ends higher as jobs data fuels rate-hike optimism,"September 2, 2023"
Legal,U.S. judge approves payouts from Elon Musk's SEC settlement,"September 1, 2023"
Autos & Transportation,Tesla releases refreshed Model 3 with longer driving range in China,"September 1, 2023"
Markets,European shares log weekly gain; Novo Nordisk most valuable European company,"September 1, 2023"
Business,Mercedes CEO: Efficiency is the 'new currency' in the EV market,"September 1, 2023"
World at Work,"UAW files unfair labor practice charges against GM, Stellantis","September 1, 2023"
Markets,Wall Street ends mixed as inflation data buoys optimism,"September 1, 2023"
Technology,"Exclusive: India's JSW in talks with Chinese carmaker Leapmotor for EV tech, sources say","August 31, 2023"
Legal,Musk blames Latham for San Francisco’s problems. Huh?,"August 31, 2023"
Legal,"Tesla faces federal probe over vehicle range after Reuters report, Wall Street Journal says","August 31, 2023"
Disrupted,Factbox: Big names in Big Tech to attend AI forum of US Senate's Schumer,"August 31, 2023"
Legal,Tesla's Musk appeals order requiring his testimony in fatal crash lawsuit,"August 30, 2023"
Markets,US equal-weighted funds shine as investors look beyond Big Tech,"August 30, 2023"
Markets,Funds punished for owning too few Nvidia shares after stunning 230% rally,"August 30, 2023"
Explainer,Explainer: What happened to shut down Toyota's production in Japan?,"August 30, 2023"
Technology,"VinFast’s volatile stock has an easy, painful fix","August 30, 2023"
Breakingviews,"S&P 500 ends sharply higher, jobs data fuels interest rate optimism","August 30, 2023"
Markets,Factbox: Tesla's Autopilot faces unprecedented scrutiny,"August 29, 2023"
Business,Tesla faces more questions from feds on Autopilot safety,"August 29, 2023"
Autos & Transportation,Piedmont Lithium receives first payment for NAL shipment,"August 29, 2023"
Markets,China's BYD H1 profit triples as deliveries break record,"August 29, 2023"
Markets,"US Senate's Schumer to host Musk, Zuckerberg, other tech leaders at AI forum","August 29, 2023"
Charged,"Hedge fund exposure to 7 biggest tech stocks at record high, Goldman Sachs says","August 28, 2023"
Technology,Vinfast rallies on after becoming world's third-most valuable automaker,"August 28, 2023"
Business,Focus: Tesla braces for its first trial involving Autopilot fatality,"August 28, 2023"
Business,China's Xpeng to acquire Didi's EV unit in deal worth up to $744 mln,"August 28, 2023"
Charged,"Exclusive: With Tesla push, India mulls import tax cut if EV makers build locally","August 25, 2023"
Technology,Xpeng's former autonomous driving head joins Nvidia,"August 25, 2023"
Business,"US will resolve Tesla Autopilot probe, could make announcement soon, official says","August 25, 2023"
Business,Payouts expected from Elon Musk's SEC settlement,"August 24, 2023"
Technology,Nvidia short sellers lose $826 mln as stock jumps after strong forecast,"August 24, 2023"
Markets,Indexes end sharply higher; AI chip maker Nvidia jumps again after the bell,"August 24, 2023"
Technology,Nvidia rallies as Wall Street anticipates pivotal report,"August 23, 2023"
Business,Tesla's German plant lowers production target amid slower output - Business Insider,"August 23, 2023"
Charged,Exclusive: China's Xiaomi wins state planner nod to make EVs amid glut in autos,"August 23, 2023"
Breakingviews,Volkswagen’s China shortcut will tempt rivals,"August 23, 2023"
Business,Beijing Hyundai puts Chongqing plant up for sale,"August 22, 2023"
Business,Tesla says two ex-employees behind May data breach,"August 21, 2023"
Business,Tesla shares gain as Baird Equity adds stock to 'best ideas' list,"August 21, 2023"
Autos & Transportation,China's EV makers face cost and consumer challenges to conquer Europe,"August 21, 2023"
Business,EV battery imports face scrutiny under US law on Chinese forced labor,"August 20, 2023"
Markets,"S&P 500 ends near flat as energy, defensive sectors counter megacap declines","August 19, 2023"
Business,Vietnam's EV firm skids for third straight US stock session after debut boom,"August 18, 2023"
Business,"Tech sell-off, rising yields push Cathie Wood's ARK ETF down 20% for month","August 18, 2023"
Business,China's Xpeng falls on dull forecast as EV price war takes toll,"August 18, 2023"
Focus,Focus: VinFast's new sales approach has US car dealers cautious but interested,"August 18, 2023"
Charged,"After stellar debut, Vietnamese EV maker VinFast's shares drop for second day","August 17, 2023"
World at Work,UAW leader says Detroit Three automakers 'still not serious' in contract talks,"August 17, 2023"
Business,Tesla warns Core Lithium of potential lawsuit over failed deal,"August 17, 2023"
Autos & Transportation,Texas approves plan to mandate Tesla tech for EV chargers despite opposition,"August 17, 2023"
Business,Tesla cuts Model S and X prices by over 6% in China,"August 16, 2023"
Business,German solar battery firm sonnen sees bigger role backing up grid,"August 16, 2023"
Markets,"China's CATL launches fast charging LFP battery, mass production expected by year-end","August 16, 2023"
Charged,Vietnam’s Tesla charges itself up for a big fall,"August 16, 2023"
Breakingviews,Vietnam's VinFast faces stern EV sales test to retain eye-popping valuation,"August 16, 2023"
Charged,VinFast's shares surge in Nasdaq debut for Vietnam EV maker,"August 16, 2023"
Charged,"Musk's X delays access to content on Reuters, NY Times, social media rivals","August 16, 2023"
Business,CFOs are stepping into a rapidly revolving door,"August 15, 2023"
Breakingviews,"Tesla launches cheaper Model S, X versions in US with shorter ranges","August 15, 2023"
Business,Nvidia shares climb as analysts raise targets ahead of report,"August 15, 2023"
Technology,Fisker to add Tesla's EV charging connector by 2025,"August 15, 2023"
Charged,"S&P 500, Nasdaq end up as Nvidia surge leads megacap higher","August 15, 2023"
Markets,Investors pummeled by tech in 2022 make new bets on sector in second quarter,"August 14, 2023"
Markets,Tesla cuts prices in China for select Model Y versions,"August 14, 2023"
Business,Indonesia says Tesla plans to invest in battery material facility,"August 14, 2023"
Breakingviews,Electric vehicle premiums will ride high in India,"August 14, 2023"
Markets,"Big tech losses sink Nasdaq, S&P as US Treasury yields rise","August 12, 2023"
Technology,Italy stands ready to host as Musk talks up Zuckerberg rumble,"August 11, 2023"
Deals,Changan Ford Motor to set up electric car JV with Chongqing Changan Auto,"August 11, 2023"
Charged,"BYD calls on China automakers to unite, 'demolish the old' in global push","August 11, 2023"
Deals,Vietnamese EV maker VinFast gets go-ahead for Nasdaq SPAC listing,"August 11, 2023"
Technology,US opens investigation into fatal Tesla crash in Virginia,"August 10, 2023"
Autos & Transportation,Indonesia gives automakers more time to qualify for EV credits in investment bid,"August 10, 2023"
Business,China EV brand Zeekr to launch its first luxury sports car,"August 10, 2023"
Markets,Wall Street ends lower as investors await US inflation data,"August 10, 2023"
Charged,Piedmont Lithium's plans to supply Tesla face skeptical North Carolina officials,"August 9, 2023"
Business,"China's Li Auto aims to outsell BMW, Mercedes, Audi in its home market in 2024","August 9, 2023"
Charged,"Rivian lifts 2023 EV production target, reassures on liquidity","August 9, 2023"
Business,Tesla's finance chief Kirkhorn unexpectedly steps down,"August 8, 2023"
Business,China's car sales fall for 2nd month in July as price war continues,"August 8, 2023"
Disrupted,San Francisco drives tech; will it drive away robot taxis?,"August 8, 2023"
Markets,"Wall St closes up, regains ground as US inflation report nears","August 8, 2023"
Technology,Musk says fight with Zuckerberg to be live-streamed on X,"August 7, 2023"
Charged,"Sumitomo, Australia's Liontown to study lithium hydroxide production in Japan","August 7, 2023"
Charged,EV maker Lucid slashes prices of Air sedan as part of offer amid heating competition,"August 5, 2023"
Legal,Wachtell taps outside law firm in Musk fight over $90 mln Twitter fee,"August 4, 2023"
Charged,EV startups burn through more cash as demand falters,"August 4, 2023"
Charged,Fisker unveils electric pickup truck even as supply chain bottleneck lingers,"August 4, 2023"
Business,"Auto parts maker Vimercati to open $200 million plant in Mexico, state governor says","August 3, 2023"
Business,Tesla discusses India plans with commerce minister Goyal in Delhi,"August 3, 2023"
Charged,Tesla faces California class action on its EV range claims,"August 3, 2023"
Charged,Mahindra's EV unit raises funds from Temasek at $9.8 billion valuation,"August 3, 2023"
Autos & Transportation,Tesla's China-made EV sales slide in July from June as BYD stretches lead,"August 3, 2023"
Business,Tesla's China-made EV sales in July down 31% mth/mth,"August 3, 2023"
Charged,"In India, it's advantage Tesla as Chinese automakers face heat","August 3, 2023"
World,"Mongolia to deepen cooperation with US on rare earths, prime minister says","August 3, 2023"
Disrupted,"AI chip firm Tenstorrent raises $100 million from Hyundai, Samsung","August 3, 2023"
Markets,"Wall Street ends down, investors step back after Fitch US rating cut","August 3, 2023"
World,"Exclusive: Mongolia, US to sign 'Open Skies' deal ahead of talks","August 3, 2023"
Markets,Insight: World battles to loosen China's grip on vital rare earths for clean energy transition,"August 2, 2023"
Insight,"Musk's X challenges India ruling on content blocking, cites censorship risk","August 2, 2023"
World,Point of no return: Australians fight for the right to work from home permanently,"August 2, 2023"
Business,"S&P 500, Nasdaq end lower on first day of August in busy earnings week","August 1, 2023"
Markets,"Huge rallies boost Tupperware, Yellow shares into 'meme stock' club","August 1, 2023"
Autos & Transportation,"US opens probe into 280,000 new Tesla vehicles over steering issue","August 1, 2023"
Charged,"Ford revs up electric truck output, testing mainstream EV demand","August 1, 2023"
Autos & Transportation,"India asks Tesla to copy Apple in pairing Chinese, Indian suppliers, sources say","August 1, 2023"
Business,"Toyota nearly doubles Q1 profit, China remains challenging","August 1, 2023"
Disrupted,"China's Leapmotor unveils new manufacturing platform, wants others to use it","August 1, 2023"
Business,"Exxon Mobil in talks with Tesla, Ford to supply lithium, Bloomberg Law reports","July 31, 2023"
Business,California agency probes automakers' data privacy practices,"July 31, 2023"
Technology,"Panasonic Q1 profit jumps, keeps full-year forecast","July 31, 2023"
Business,US proposes raising vehicle fuel economy standards to 58 miles per gallon by 2032,"July 31, 2023"
Business,"Tesla to cut prices on some Model 3, Model Y in Hong Kong, media report","July 31, 2023"
Business,Swiss National Bank hit by $15 billion second quarter loss,"July 31, 2023"
Technology,Musk draws heat from San Francisco over giant X logo,"July 31, 2023"
Markets,Exclusive: Sigma Lithium CEO says in talks with potential buyers,"July 29, 2023"
Business,"Maserati will never enter a price war with competitors, CEO says","July 28, 2023"
Business,Tesla executives hold market entry talks with India investment agency,"July 28, 2023"
World,Texas Tesla plant receives false alarm of active shooter,"July 28, 2023"
Business,"Panasonic, Subaru expected to announce EV battery plan, Nikkei reports","July 28, 2023"
Autos & Transportation,Global automakers scramble to reset China strategies as sales slow,"July 28, 2023"
Markets,Brazil's Vale to sell 13% stake in base-metals unit for $3.4 billion,"July 28, 2023"
U.S. Markets,Dow Jones index set to end 13 day winning streak,"July 28, 2023"
World,"US Senate panel passes AM radio, ticket fee pricing bills","July 27, 2023"
Business,Italian brake maker Brembo sees few signs of slowdown,"July 27, 2023"
Business,VW cuts sales outlook as EV competition heats up,"July 27, 2023"
Technology,Automakers' demand helps STM weather softening chip market,"July 27, 2023"
Charged,Western car makers look to slash EV costs to fight Chinese 'invasion',"July 27, 2023"
Podcasts,"Tesla’s secret team, what Africa wants from Russia - and Meloni woos Washington","July 27, 2023"
World,Tesla created secret team to suppress thousands of driving range complaints,"July 27, 2023"
Charged,"LGES warns of sluggish EV demand in Europe, quarterly profit misses forecasts","July 27, 2023"
Charged,"In challenge to Tesla, automakers launch US EV charging network","July 27, 2023"
Business,"Volkswagen buys Xpeng stake, partners with SAIC to boost China EV lineup","July 26, 2023"
Charged,Stellantis CEO says Tesla margins hurt as EV maker faces reality check,"July 26, 2023"
Business,"Stellantis tops forecasts, looks to cost cuts to keep margins strong","July 26, 2023"
Business,Hyundai Motor lifts full-year outlook as Q2 profit up 15%,"July 26, 2023"
Focus,"Focus: In Mexico, private cash races to plug nearshoring energy crunch","July 26, 2023"
Markets,"Morning Bid: Tech splits, banks merge and Fed decides","July 26, 2023"
Business,GM shares fall as automaker outlines new cost-cutting drive,"July 25, 2023"
Charged,GM does a U-turn to save the Chevy Bolt,"July 25, 2023"
Charged,EV charger operator EVCS seeks to raise $125 million to expand network,"July 25, 2023"
Legal,Elon Musk to appeal loss in SEC case to Supreme Court,"July 25, 2023"
Technology,Battery giant CATL posts slower profit growth as competition heats up,"July 25, 2023"
Charged,"Indonesia plans incentives for EV makers, sets up meeting with BYD, Tesla","July 25, 2023"
World at Work,Toyota's China joint venture dismisses about 1000 workers,"July 24, 2023"
Charged,"Tesla to discuss factory plan for new $24,000 car with India commerce minister","July 24, 2023"
Legal,"Law firm Fisher Phillips expands to Mexico amid labor law changes, nearshoring","July 24, 2023"
Markets,Wall Street heavyweights mixed ahead of Nasdaq 100 rebalance,"July 24, 2023"
Business,"French auto supplier Plastic Omnium reports strong growth, shares rise","July 24, 2023"
Litigation,US appeals court to reconsider decision on Elon Musk tweet about unions,"July 21, 2023"
Charged,Analysis: Tesla taps Biden tax credits to offset EV price cuts,"July 21, 2023"
World at Work,UAW seeks Washington backing to pressure Detroit Three automakers in labor talks,"July 21, 2023"
Markets,"Morning Bid: Dollar flexes into Fed week, calm returns","July 21, 2023"
World at Work,Analysis: Elon Musk and Tesla loom over Detroit's auto labor talks,"July 21, 2023"
Markets,"China's steps to boost sales of cars, electronics disappoint market","July 21, 2023"
Disrupted,"Tesla's Elon Musk optimistic on progress for self-driving, robots","July 21, 2023"
Markets,Morning Bid: Markets shrug off upbeat news from Japan and China,"July 21, 2023"
Markets,"Tesla, Netflix pull Nasdaq and S&P lower, Dow ends higher","July 21, 2023"
Markets,Morning Bid: Fragile Friday as big tech finally falters,"July 21, 2023"
World,How Chile's progressive new plan to mine lithium faces Indigenous hurdles,"July 20, 2023"
Business,Tesla investors balk at margin loss as Musk touts self-driving future,"July 20, 2023"
Markets,"Dollar gains, stocks fall as US data suggests rates to stay higher","July 20, 2023"
World,TSX ends lower as 'risk-reward' deteriorates for investors,"July 20, 2023"
Technology,"Tesla, ABB, TSMC get Q2 earnings off to downbeat start","July 20, 2023"
World,China's sagging economy looms over quarterly results around the world,"July 20, 2023"
Business,"Morning Bid: Tesla, Netflix underwhelm","July 20, 2023"
Markets,Malaysia issues license to Musk's Starlink to bring internet services to remote areas,"July 20, 2023"
Technology,Tesla’s new burden: shouldering the market,"July 20, 2023"
Breakingviews,"Tesla may keep cutting prices in 'turbulent times', Musk says","July 20, 2023"
Charged,Morning Bid: Barbie hits the box office,"July 20, 2023"
Markets,"Tesla wants to double the size of its European assembly plant, New York Times reports","July 20, 2023"
Business,Stocks advance as earnings pick up; Dow notches 8th day of gains,"July 20, 2023"
Markets,Morning Bid: China to keep rates on hold ... for now,"July 19, 2023"
Markets,Tesla to hand over Musk's emails to JPMorgan in lawsuit over 2018 tweet,"July 19, 2023"
Legal,"Tesla plans sweeping expansion to Berlin plant, cell production","July 19, 2023"
Autos & Transportation,"Japan's Nissan to adopt Tesla EV-charging design from 2025 in U.S., Canada","July 19, 2023"
Charged,Britain upgrades to also-ran in EV battery race,"July 19, 2023"
Breakingviews,"Morning Bid: Big Tech weighs in, UK relieved","July 19, 2023"
Markets,Morning Bid: Britain's CPI the next frontier,"July 19, 2023"
Markets,Vietnam EV maker VinFast to start construction of US factory next week,"July 19, 2023"
Charged,US opens special probe into fatal Tesla crash,"July 19, 2023"
Charged,Tesla faces citizen grilling on impact of German plant expansion,"July 18, 2023"
Markets,Wall St ends higher with earnings poised to ramp up,"July 18, 2023"
Autos & Transportation,Ford slashes prices of F-150 Lightning trucks as EV wars heat up,"July 17, 2023"
Markets,"US stocks rise on earnings outlook, global shares dip on China data","July 17, 2023"
Legal,"Musk, Tesla go on attack against Dogecoin plaintiffs lawyer","July 17, 2023"
Legal,Tesla directors pay $735 mln to settle lawsuit over excess compensation,"July 17, 2023"
Markets,"European shares slip as Richemont, China data drag","July 17, 2023"
Transactional,Tesla sues Australia's Cap-XX over EV battery technology,"July 17, 2023"
World at Work,German union calls for better staffing at Tesla plant amid expansion plans,"July 17, 2023"
Technology,"Tesla discounts set to power quarterly revenue growth, hit profit","July 17, 2023"
Markets,Morning Bid: China falls short and oil ebbs but banks impress,"July 17, 2023"
Take Five,"Take Five: Buddy, can you spare a dollar?","July 17, 2023"
Markets,Morning Bid: Bland China data leaves market hungry for stimulus,"July 17, 2023"
Markets,Morning Bid: Will China GDP spoil the party?,"July 16, 2023"
Charged,Tesla builds first Cybertruck after two years of delays,"July 15, 2023"
Disrupted,"Elon Musk says xAI will examine universe, work with Twitter and Tesla","July 15, 2023"
Markets,"S&P 500 ends down with banks mostly lower, indexes post weekly gains","July 15, 2023"
Markets,Wall St Week Ahead Investors brace for earnings from ‘Magnificent Seven’ US growth giants,"July 14, 2023"
Markets,Investors in VinFast's SPAC cash out most shares,"July 14, 2023"
Business,Highly shorted Nikola jumps as retail army scoops up shares after BayoTech deal,"July 14, 2023"
Charged,"Exclusive: BYD proposes $1 billion India plan to build EVs, batteries","July 14, 2023"
Charged,China's BYD says first-half net profit could more than triple,"July 14, 2023"
World at Work,Tesla's Shanghai factory workers welcome bonus increase after record deliveries,"July 14, 2023"
Charged,Tesla begins sale of cheaper Model Y vehicle in South Korea,"July 14, 2023"
Markets,"Malaysian PM Anwar discusses Tesla investment, Starlink with Musk","July 14, 2023"
Technology,"India's finance ministry not considering tax waivers for Tesla, senior official says","July 13, 2023"
Business,A US auto union president who accepts 'no limits',"July 13, 2023"
World at Work,Explainer: Auto industry on tenterhooks as UAW kicks off talks with 'Detroit Three',"July 13, 2023"
Technology,Elon Musk launches AI firm xAI as he looks to take on OpenAI,"July 13, 2023"
World,Nearly 100 US lawmakers urge EPA to finalize tougher vehicle emissions cuts,"July 13, 2023"
Business,"Tesla looking to make about half million EVs annually in India, Times of India reports","July 13, 2023"
Disrupted,Elon Musk thinks China is interested in an international AI framework,"July 13, 2023"
Charged,Lucid shares drop as deliveries take hit from Tesla's price war,"July 12, 2023"
Charged,Tesla says Model 3 consumer tax credits likely to be reduced after Dec.31,"July 12, 2023"
Charged,"Texas defers decision on EV charging funds amid industry pushback on Tesla plugs, sources say","July 12, 2023"
Explainer,Explainer: What is Nasdaq's special rebalancing and its impact?,"July 12, 2023"
Charged,Audi in talks to buy Chinese automaker SAIC's EV platform -sources,"July 12, 2023"
Markets,Japan steelmaker JFE says Tesla-pioneered tech poses 'very big problem' for it,"July 12, 2023"
Business,"Faraday Future interim CFO resigns, firm to restate certain financial reports","July 12, 2023"
Breakingviews,Uber’s next CFO has one simple task,"July 11, 2023"
Charged,US EV market struggles with price cuts and rising inventories,"July 11, 2023"
Charged,EV charger maker Tritium wins order from Hawaii under federal funding program,"July 11, 2023"
Charged,Explainer: What's behind China's failed 'truce' in EV price war?,"July 11, 2023"
Markets,Market heavyweights dip ahead of Nasdaq 100 rebalance,"July 11, 2023"
Business,Rivian options buyers may be helping drive stock higher,"July 10, 2023"
Autos & Transportation,GM cuts Lyriq EV price in China by 14% as market pressures intensify,"July 10, 2023"
Markets,China's car sales shrink 2.9% in June as big-ticket spending falters,"July 10, 2023"
Breakingviews,China car price truce skids off road at first bend,"July 10, 2023"
Charged,China-led EV boom in Thailand threatens Japan's grip on key market,"July 10, 2023"
Charged,Innovation in EVs seen denting copper demand growth potential,"July 10, 2023"
Charged,"France upbeat on attracting major Tesla investment, finance minister says","July 9, 2023"
Business,China's auto group retracts pledge to avoid 'abnormal pricing',"July 8, 2023"
Legal,Elon Musk sues Wachtell law firm to recoup fees from Twitter buyout,"July 7, 2023"
Charged,Tesla wants EPA to finalize tougher vehicle emissions rules,"July 7, 2023"
Charged,Rivian's stock rallies to highest in 2023 after posting strong deliveries,"July 7, 2023"
Charged,Tesla rolls out customer referral incentive globally as EV price war heats up,"July 7, 2023"
Charged,Mercedes-Benz picks Tesla's charging standard for North America EVs from 2025,"July 7, 2023"
Technology,Elon Musk's SpaceX to launch satellite internet service in Mongolia,"July 7, 2023"
Charged,Tesla offers new China rebate as price cuts rock EV market,"July 7, 2023"
Charged,Fisker misses second-quarter production target due to parts shortage,"July 7, 2023"
Technology,Malaysia PM Anwar to meet Elon Musk to discuss investments,"July 7, 2023"
Breakingviews,Beijing’s autos intervention is a necessary evil,"July 7, 2023"
