Section,Title,Date
Markets,"ARK's Wood says Fed is making a 'mistake,' sees stocks bottoming","July 12, 2022"
Business,Exclusive: Pernod told India its protracted tax fight inhibits fresh investments there,"July 12, 2022"
Legal,Breakingviews: Twitter may be target for non-Musk deal,"July 12, 2022"
Charged,China's Geely launches electric pickup as urbanites embrace camping,"July 12, 2022"
Business,Chinese electric car company BYD slides on speculation Buffett is reducing stake,"July 12, 2022"
Technology,France's Macron: I wouldn't change anything in dealings with Uber,"July 12, 2022"
World,VW of America teams with Redwood on EV battery recycling,"July 12, 2022"
Autos & Transportation,"Twitter hits back at Musk, says no deal obligations breached","July 12, 2022"
Markets,Focus: Drivers face black or white choice to speed up new-car delivery,"July 12, 2022"
Focus,Musk's Tesla stock sale windfall dwarfs Twitter loss,"July 12, 2022"
Business,Twitter says it has not breached merger agreement with Elon Musk,"July 11, 2022"
Technology,Twitter hires law firm Wachtell to sue Musk after pulling out of $44 billion deal,"July 11, 2022"
Technology,Twitter shakes Musk down with Delaware muscle,"July 11, 2022"
Breakingviews,"Binance served crypto traders in Iran despite U.S. sanctions, clients say","July 11, 2022"
Markets,Twitter vows legal fight after Musk pulls out of $44 billion deal,"July 11, 2022"
Technology,"Focus: For EV battery makers, it's go small or go home","July 11, 2022"
Charged,"Mars, birth rates, but no Twitter: Elon Musk captivates Sun Valley moguls","July 10, 2022"
Business,Breakingviews: Musk lit a fire Twitter didn’t know it needed,"July 9, 2022"
Breakingviews,Twitter workers brace for more 'circus' after Elon Musk torpedoes deal,"July 9, 2022"
Markets,U.S. agency to open probe into fatal Florida Tesla crash,"July 9, 2022"
Business,U.S. opens special probe into fatal Tesla pedestrian crash in California,"July 8, 2022"
Business,Elon Musk plans to 'significantly' increase childcare benefits at his firms,"July 8, 2022"
Business,Tesla Berlin factory to go on a break for two weeks - Handelsblatt,"July 8, 2022"
Business,Tesla sells record high China-made vehicles in June,"July 8, 2022"
Business,U.S. job growth likely slowed in June; unemployment rate seen at 3.6%,"July 8, 2022"
Markets,Samsung Electro-Mechanics says in talks with Tesla to possibly supply camera modules,"July 8, 2022"
Technology,Factbox: U.S. business leaders who lost their jobs over personal relationships,"July 8, 2022"
Business,"S&P, Nasdaq end higher as July hot streak continues","July 8, 2022"
Markets,"Volkswagen, partners to invest $20 bln in car battery business","July 7, 2022"
Charged,"U.S. labor market starts to cool as weekly jobless claims rise, layoffs surge","July 7, 2022"
Markets,"Elon Musk had twins last year with one of his top executives, Insider says","July 7, 2022"
Technology,Meme stock GameStop jumps on share split bandwagon,"July 7, 2022"
Markets,SEC's Gary Gensler: ‘There needs to be clear rules of the road for disclosing climate risk',"July 6, 2022"
Business,"Tesla sold 78,000 China-made vehicles in June, up 142% vs May -CPCA estimates","July 6, 2022"
Business,"Laid-off Tesla workers file emergency plea, allege small severance pay","July 6, 2022"
Business,Tesla plays 'whack-a-mole' with snags as deliveries fall for first time in two years,"July 5, 2022"
Business,"Volkswagen's software unit to be streamlined, Cariad head tells FAZ","July 4, 2022"
Business,"German road traffic agency says 59,000 Tesla vehicles have software glitch","July 3, 2022"
Business,"Tesla's deliveries fall, hurt by China's COVID shutdown","July 2, 2022"
Autos & Transportation,GM outsells Toyota in Q2 as inventory shortages linger,"July 1, 2022"
Business,Tesla hit by new lawsuit alleging racial abuse against Black workers,"July 1, 2022"
Macro Matters,U.S. factory activity slows to two-year low as clouds gather over economy,"July 1, 2022"
Technology,Chip stocks hammered as Micron forecast signals waning demand,"July 1, 2022"
Disrupted,"U.S. approves SpaceX's Starlink internet for use with ships, boats, planes","July 1, 2022"
Business,Tesla's run of record deliveries may be reaching the end of the road,"June 30, 2022"
Macro Matters,U.S. employers see signs of cooling job market,"June 30, 2022"
Charged,British EV startup Tevva launches hydrogen booster truck model,"June 30, 2022"
Charged,Fans take BYD to task as recall confusion clouds Chinese EV maker's image,"June 30, 2022"
Breakingviews,Li Auto makes hay while electric sun shines,"June 30, 2022"
Business,"BP, Shell to cover employee travel for treatment after Roe v. Wade","June 30, 2022"
World,Factbox: Companies offering abortion travel benefits to U.S. workers,"June 29, 2022"
Business,"Companies cut spending, jobs as outlook grows less certain","June 29, 2022"
Breakingviews,Texas becomes Tesla’s new China,"June 29, 2022"
Charged,LG Energy signs battery-grade lithium supply deal with Compass Minerals,"June 29, 2022"
Business,"Tesla closes an office as layoff hits Autopilot jobs, including hourly ones","June 29, 2022"
Charged,S.Korea's LGES reviews $1.3 bln Arizona battery investment as U.S. inflation bites,"June 29, 2022"
Lifestyle,"Australia's Liontown inks lithium deal with Ford after Tesla, LG agreements","June 29, 2022"
Charged,"U.S. vehicle quality hits 36-year low as supply, labor woes continue - J.D. Power","June 28, 2022"
Business,Easing chip shortages to help Volkswagen in H2 - CEO,"June 28, 2022"
Business,Siemens to invest in Volkswagen's N.American charging network,"June 28, 2022"
Charged,Japan's Nissan suspends Russia production for six months,"June 28, 2022"
Business,UK green supply chain startup Circulor raises $25mln for US expansion,"June 28, 2022"
Deals,Albemarle plans major U.S. lithium processing plant,"June 27, 2022"
Energy,Judge orders new trial in Tesla worker's race bias lawsuit,"June 27, 2022"
Business,"Disney, other U.S. companies offer abortion travel benefit after Roe decision","June 25, 2022"
World,JPMorgan to cover U.S. staff travel costs for out-of-state abortions -memo,"June 24, 2022"
World,Job losses add turbulence to Fed’s softish landing,"June 24, 2022"
Breakingviews,Factbox: U.S. companies offering abortion travel benefits,"June 24, 2022"
World,Toyota recalls first mass-produced EVs less than 2 months after launch,"June 24, 2022"
Charged,Lithium landgrab sparks new electric-car risk,"June 24, 2022"
Breakingviews,Ashurst expands U.S. footprint with office opening in Austin,"June 23, 2022"
Legal,Insight: Biden administration leans on Tesla for guidance in renewable fuel policy reform,"June 23, 2022"
Charged,Vinfast could eventually offer an electric pickup -executive,"June 23, 2022"
Business,Musk says Tesla's new car factories 'losing billions of dollars',"June 23, 2022"
Charged,China's CATL to produce next-generation EV battery in 2023,"June 23, 2022"
Charged,BMW starts production at new $2.2 bln China plant to ramp up EV output,"June 23, 2022"
Charged,CATL has supplied EV batteries to S.Korea's Kia - CATL spokesperson,"June 23, 2022"
Technology,Twitter tests long-form text feature called 'Notes',"June 23, 2022"
Markets,Latest meme stock Revlon surges more than 50% in heavy trading,"June 22, 2022"
Focus,Focus: Piedmont Lithium looks abroad amid North Carolina uncertainty,"June 22, 2022"
Legal,Elon Musk might want to be careful what he wishes for,"June 22, 2022"
Charged,Limited edition of Citroen's mini EV sells out in under 18 minutes,"June 22, 2022"
Business,EXCLUSIVE Tesla plans 2-week suspension for most Shanghai production for upgrade - memo,"June 22, 2022"
Legal,Tesla hires new lawyer in compliance role amid legal battles,"June 22, 2022"
Markets,Wall Street gains over 2% in broad rebound,"June 22, 2022"
Business,U.S. regulators to propose new tougher vehicle emissions rules by March,"June 21, 2022"
Business,U.S. agency sought answers from Tesla on Autopilot in April 2021 -letter,"June 21, 2022"
Business,Tesla worker rejects $15 mln payout in race bias lawsuit,"June 21, 2022"
Business,Tesla sued by former employees over 'mass layoff',"June 21, 2022"
Markets,"Anticipating U.S. downturn, Elon Musk details Tesla staff cuts","June 21, 2022"
U.S. Markets,Wall Street sees higher probability of U.S. recession next year,"June 21, 2022"
Legal,U.S. Supreme Court rejects Musk-backed challenge to SEC's 'gag' rule,"June 21, 2022"
Charged,Toyota joins Redwood Materials' EV battery recycling initiative,"June 21, 2022"
Charged,Focus: Electric automakers make last-ditch plea for more tax credits before U.S. election,"June 21, 2022"
Business,Tesla under pressure to boost wages to attract workers to German plant,"June 21, 2022"
Business,"Tesla to cut salaried workforce by 10% over next 3 months, says Musk","June 21, 2022"
World,Elon Musk's child seeks name change to sever ties with father,"June 21, 2022"
Business,"Tesla cars barred for 2 months in Beidaihe, site of China leadership meet","June 20, 2022"
Breakingviews,This Chinese jobs crisis could be its worst,"June 20, 2022"
Charged,"GM hikes Hummer EV price by over $6,000 as commodity, shipping costs rise","June 17, 2022"
Future of Money,Elon Musk sued for $258 billion over alleged Dogecoin pyramid scheme,"June 17, 2022"
Technology,SpaceX fires at least five over letter critical of Elon Musk,"June 17, 2022"
Business,"Tesla investor sues Musk, board over accusation of workplace discrimination","June 17, 2022"
Charged,Tesla raises prices for some Model Y cars in China,"June 17, 2022"
Technology,"In call with Twitter staff, Elon Musk muses on space aliens, company's future","June 17, 2022"
Focus,Focus: Tesla cuts job openings since Elon Musk's economic warning,"June 16, 2022"
Technology,"SpaceX employees denounce CEO Musk as ""distraction"" - letter","June 16, 2022"
Charged,Tesla to charge more for cars in United States as inflation bites,"June 16, 2022"
Charged,Ferrari says going electric means 'even more unique' cars,"June 16, 2022"
Autos & Transportation,Tesla leads in driver-assisted technology crashes -U.S. data,"June 16, 2022"
Markets,Elon Musk expected to confirm desire to own Twitter in meeting Thursday - WSJ,"June 16, 2022"
World,Tesla's Musk says he's leaning towards DeSantis for president,"June 15, 2022"
Legal,Elon Musk files appeal to end SEC decree over Twitter posts,"June 15, 2022"
Business,Caterpillar to move global headquarters from Illinois to Texas,"June 15, 2022"
Business,ARK's Cathie Wood keeps focus on deflation as fund slump continues,"June 14, 2022"
Business,Tesla India policy executive quits after company puts entry plan on hold,"June 14, 2022"
Charged,Bear market confirmed as U.S. stocks' 2022 descent deepens,"June 14, 2022"
Markets,"As S&P 500 confirms bear market, most of its components look worse","June 14, 2022"
Markets,BMW to test ONE's advanced battery in its iX electric SUV,"June 14, 2022"
Charged,"EXCLUSIVE U.S. automaker CEOs, Toyota urge Congress to lift EV tax credit cap","June 13, 2022"
Charged,"Tesla hiring 500-600 staff a month at German plant, regional economy minister says","June 13, 2022"
Business,Vigna to set out Ferrari's route into electric vehicle era,"June 13, 2022"
Charged,LG Energy Solution to invest $568 million in South Korean factories,"June 13, 2022"
Business,Tesla to seek investor approval for 3-for-1 stock split,"June 11, 2022"
Business,"Tesla's China output decline trending deeper than Musk forecast, data and internal memos show","June 10, 2022"
Charged,Tesla cancels three June online hiring events for China,"June 10, 2022"
Charged,Chinese EV maker Nio to make self-developed battery packs from 2024,"June 10, 2022"
Charged,"U.S. agency upgrades Tesla Autopilot safety probe, step before possible recall","June 10, 2022"
Charged,"Insight: How a battery shortage is hampering the U.S. switch to wind, solar power","June 9, 2022"
Insight,Tesla goes ahead with China hiring event after Musk job warning,"June 9, 2022"
Charged,"China's exports surge on easing COVID curbs, trade outlook still fragile","June 9, 2022"
Business,"Tesla Autopilot concerns are on U.S. agency's 'radar,' chair says","June 9, 2022"
Autos & Transportation,"Tesla sold 32,165 China-made vehicles in May","June 9, 2022"
Technology,Tesla barred from pausing race bias case while challenging agency's powers,"June 8, 2022"
Technology,Twitter tests reminder feature for limited edition product sales,"June 8, 2022"
Markets,"After lockdown, Shanghai tries to mend fences with foreign firms","June 8, 2022"
The Great Reboot,"WalMart expands transportation partnerships with electric, hydrogen vehicle pilots","June 8, 2022"
Disrupted,BYD executive says it will supply batteries to Tesla 'very soon',"June 8, 2022"
Charged,Judge gives former Tesla worker a deadline to accept $15 mln payout over racism,"June 7, 2022"
Legal,Exclusive: Musk's Twitter deal threats put new financing on ice -sources,"June 7, 2022"
Technology,Tesla attacks California agency for filing race bias lawsuit,"June 7, 2022"
World,Shopify shareholders give CEO 40% voting stake - source,"June 7, 2022"
Business,Analysis: Apple's next frontier is your car's dashboard,"June 7, 2022"
Disrupted,"Special Report: How crypto giant Binance became a hub for hackers, fraudsters and drug traffickers","June 7, 2022"
Legal,Benfica to join crypto craze with Socios,"June 7, 2022"
Sports,Musk threatens to tear up Twitter deal over 'material breach',"June 7, 2022"
Markets,"China's May exports, imports seen recovering as supply chains restart, Reuters poll shows","June 7, 2022"
Macro Matters,Amazon stock split may draw retail traders in tough market,"June 7, 2022"
Markets,Analysis: Elon Musk opens door to a Tesla talent exodus,"June 7, 2022"
Analysis,"Terms don’t kill deals, people do","June 6, 2022"
Markets,U.S. House speaker Pelosi discloses trades in Apple and Microsoft,"June 6, 2022"
Markets,"Morning Bid: ""Super bad feeling""","June 6, 2022"
Analysis,Analysis: Musk's warning could be auto industry's 'canary in the coal mine' moment,"June 6, 2022"
Business,"Elon Musk backtracks on job cuts, says Tesla salaried staff to be 'fairly flat'","June 5, 2022"
Markets,Wall St ends down with strong jobs data keeping the pressure on for rate hikes,"June 4, 2022"
Technology,Exclusive: Elon Musk wants to cut 10% of Tesla jobs,"June 4, 2022"
Charged,U.S. NHTSA asks Tesla to respond by June 20 in brake activation probe,"June 3, 2022"
Legal,Latest U.S. jobs report shows more legal sector growth in May,"June 3, 2022"
Markets,Citi CEO sees recession more likely in Europe than U.S.,"June 3, 2022"
World,Biden wishes Elon Musk 'luck' on moon trip after job cut plans,"June 3, 2022"
Business,"Rivian R1T electric truck 'way underpriced,' but room to improve -expert","June 3, 2022"
Macro Matters,"Fed may need to stick to half-point rate hikes, Mester says","June 3, 2022"
Markets,Reactions: Elon Musk's 'super bad feeling' about the economy,"June 3, 2022"
Breakingviews,"Tesla’s pole position is a blessing, then a curse","June 3, 2022"
Markets,Musk deal for Twitter dodges lengthy U.S. antitrust review,"June 3, 2022"
Charged,Panasonic evaluating choices of U.S. state for battery plant,"June 3, 2022"
Technology,Australian tech billionaire takes on Elon Musk's 'return to office' directive,"June 3, 2022"
Technology,Elon Musk says Tesla AI Day pushed to Sept 30,"June 3, 2022"
Markets,Some hedge funds face steep losses after betting on hot sectors,"June 3, 2022"
The Great Reboot,"As Shanghai reopens, California ports prepare for cargo surge","June 3, 2022"
Markets,"Wall Street ends sharply higher, led by Tesla and Nvidia","June 3, 2022"
Business,Engine No. 1 rushes to back ESG disclosures at top companies,"June 2, 2022"
Charged,"Ford to invest $3.7 bln for production of EVs, gas-powered vehicles","June 2, 2022"
Breakingviews,GM draws target on Tesla with EV price cut,"June 2, 2022"
The Great Reboot,Musk's office ultimatum faces pushback in Germany,"June 2, 2022"
World,China's Geely launches first nine low-orbit satellites for autonomous cars,"June 2, 2022"
Disrupted,Insight: No more bambinos? Italy's firms move to tackle birth crisis,"June 2, 2022"
Insight,Global cracks complicate West’s energy transition,"June 2, 2022"
Breakingviews,"China EV startups say May sales up, post-lockdown output constrained","June 2, 2022"
Charged,GM to cut prices on EV Chevrolet Bolt up to 18 percent,"June 1, 2022"
Business,Elon Musk tells Tesla staff: return to office or leave,"June 1, 2022"
The Great Reboot,Tesla delays deliveries of long-range models in U.S.,"June 1, 2022"
Business,Eight automakers adopt U.S. EV fire response recommendations,"June 1, 2022"
Charged,"Ford may slash ad spending, revamp dealers to boost EV profit, CEO says","June 1, 2022"
Charged,Stock rally not enough to save ARK from record 7-month losing streak,"June 1, 2022"
Markets,Panasonic sends Tesla new EV battery samples ahead of production surge,"June 1, 2022"
Autos & Transportation,WM Motor fundraise will test its anti-Tesla appeal,"June 1, 2022"
Breakingviews,"Volkswagen's race with Tesla will be tight, Diess says","June 1, 2022"
Charged,Focus: How a cheap component could help kill off combustion cars,"May 30, 2022"
The Great Reboot,Tesla Shanghai plant restores weekly output to 70% of pre-lockdown level -sources,"May 30, 2022"
Technology,Google backs India's ShareChat in $300 mln funding round at $5 bln valuation,"May 30, 2022"
Macro Matters,China's factory activity likely contracted more slowly in May - Reuters poll,"May 30, 2022"
Business,Russia freezes trading in up to 14% of U.S.-listed shares on SPB Exchange,"May 30, 2022"
Charged,Rivian executive in charge of manufacturing quits in management rejig,"May 28, 2022"
Markets,"Wall Street rallies, snaps longest weekly losing streak in decades","May 28, 2022"
Business,U.S. agency asks Tesla for information on Canadian fire incident,"May 28, 2022"
Markets,U.S. SEC looking into Musk's Twitter stake purchase,"May 27, 2022"
Business,Transport Canada probing cause of Tesla fire in Vancouver,"May 27, 2022"
Breakingviews,Twitter gives investors the snub they deserve,"May 27, 2022"
Markets,"Twitter keeps Musk ally Durban on board, rejects resignation","May 27, 2022"
World,Shanghai takes baby steps towards ending COVID lockdown,"May 27, 2022"
Charged,CATL says to supply BMW with cylindrical cell from 2025,"May 27, 2022"
Markets,Musk sued by Twitter investors for stock 'manipulation' during takeover bid,"May 27, 2022"
Markets,"Wall Street jumps on retailer outlook hikes, ebbing Fed fears","May 27, 2022"
World,Tesla submits application to expand German plant - rbb,"May 26, 2022"
Business,Global firms warn of sluggish China demand due to lengthy COVID curbs,"May 26, 2022"
Markets,"Car sales dampened by chip shortage, COVID measures","May 26, 2022"
Macro Matters,Focus: Silver Lake's backing of dealmaking CEOs pays off,"May 26, 2022"
Markets,"Musk pledges more equity to fund Twitter deal, scraps margin loan","May 26, 2022"
Autos & Transportation,Insight: Global automakers face electric shock in China,"May 26, 2022"
Business,Factbox: How is Elon Musk funding his $44 bln offer to buy Twitter,"May 26, 2022"
Markets,Wall Street rallies as Fed minutes meet expectations,"May 26, 2022"
Markets,Twitter investors vote against re-electing Elon Musk ally to board,"May 25, 2022"
Charged,U.S. automated electric truck startup Solo AVT picks battery supplier ABS,"May 25, 2022"
Markets,Retail inflows at nearly all-time high despite market turbulence,"May 25, 2022"
Charged,Factbox: South Korean EV battery makers in $13 billion spree to win U.S. market,"May 25, 2022"
Charged,"Focus: For EV maker Rivian, delivery headache hits as market shuts down coffers","May 24, 2022"
World,Tesla loses bid to move sexual harassment lawsuit to arbitration,"May 24, 2022"
Breakingviews,Snap! Elon Musk has another Twitter excuse,"May 24, 2022"
Insight,"Insight: In a faceoff with Elon Musk, the SEC blinked","May 24, 2022"
World,"Beijing ramps up COVID quarantines, Shanghai residents decry uneven rules","May 24, 2022"
Business,Tesla investor Streur says carmaker still believes in ESG,"May 23, 2022"
Technology,New York pension fund urges votes against Twitter and Meta directors over shootings,"May 23, 2022"
Markets,U.N. official still hopes Musk will 'step up' to fight world hunger,"May 23, 2022"
Commodities,Insight: Legendary lithium riches from Bolivia's salt flats may still just be a mirage,"May 23, 2022"
Charged,Tesla plans to ramp up to pre-lockdown output in Shanghai by Tuesday,"May 23, 2022"
Explainer,Explainer: Do claims against Musk raise a legal issue for his companies and Twitter deal?,"May 23, 2022"
Analysis,"Analysis: Tesla brand threatened by Musk harassment claim, criticism of Democrats","May 22, 2022"
Markets,Wall Street ends mixed after punishing week,"May 21, 2022"
World,Brazil's Bolsonaro calls Musk's Twitter bid a 'breath of hope',"May 21, 2022"
Markets,Bear market beckons as stock volatility continues in 2022,"May 20, 2022"
World,Musk denies he sexually harassed flight attendant; Tesla shares sink,"May 20, 2022"
Analysis,Analysis: Musk's ESG attack spotlights $35 trillion industry confusion,"May 20, 2022"
Business,Volkswagen supervisory board demands more ambitious software roadmap - sources,"May 20, 2022"
Breakingviews,Musk’s get-out-of-Twitter card is worth $5 bln,"May 20, 2022"
Business,Renault boss Luca de Meo could return to Japan in June,"May 20, 2022"
Charged,"Nissan, Mitsubishi Motors unveil light EVs for Japan","May 20, 2022"
Macro Matters,Shanghai economy hit on all sides in April by COVID lockdown,"May 20, 2022"
Disrupted,Twitter to tackle Ukraine conflict misinformation with warning labels,"May 20, 2022"
World,"Elon Musk to meet with Brazil's Bolsonaro, says report","May 20, 2022"
Markets,Musk says 'Tesla is on my mind 24/7' amid concerns about Twitter distraction,"May 20, 2022"
Business,U.S. banks' 2021 hiring show lenders are seeking talent far beyond Wall Street,"May 19, 2022"
Markets,Musk's $44-bln deal for Twitter proceeding as expected - Bloomberg News,"May 19, 2022"
Business,"Tesla cut from S&P 500 ESG Index, and Elon Musk tweets his fury","May 19, 2022"
China,Some in Shanghai allowed out to shop; end of COVID lockdown in sight,"May 19, 2022"
Breakingviews,Market rout throws off math for open deals,"May 19, 2022"
Business,Deutsche Bank links Henkel supply chain financing to ESG ratings,"May 19, 2022"
Charged,Renault unveils hydrogen-powered prototype SUV in race to cleaner driving,"May 19, 2022"
Business,U.S. agency opens probe into fatal Tesla vehicle crash that killed three,"May 19, 2022"
World,"Tesla's Musk says he 'can no longer support' Democrats, 'will vote Republican'","May 19, 2022"
Markets,Wall Street ends sharply lower as Target and growth stocks sink,"May 19, 2022"
Markets,Column: Nickel demand boomed in 2021; this year it will be supply,"May 19, 2022"
Breakingviews,Twitter board’s “fool me thrice” risk,"May 18, 2022"
World,"Mastercard to cover employee travel, lodging for out-of-state abortions","May 18, 2022"
Charged,"Canoo production starts could slip, but CEO remains confident in funding","May 18, 2022"
Markets,Morning Bid: Extreme fear? Seriously?,"May 18, 2022"
World,'Huge' pressure for Shanghai to stay COVID-free as lockdown end nears,"May 18, 2022"
Charged,EXCLUSIVE China in talks with automakers on EV subsidy extension -sources,"May 18, 2022"
Markets,"Wall Street ends sharply higher, fueled by Apple","May 18, 2022"
Technology,Tesla to host second artificial intelligence day in August,"May 18, 2022"
Markets,Prominent hedge funds invested in Twitter before Musk unveiled plans,"May 18, 2022"
Disrupted,Elon Musk's SpaceX is poised to become the most valuable U.S. startup,"May 18, 2022"
Disrupted,"Tesla cars, Bluetooth locks, vulnerable to hackers, researchers say","May 17, 2022"
Autos & Transportation,Tesla stops taking orders for Cybertruck outside North America,"May 17, 2022"
Charged,Mercedes-Benz to use energy-dense silicon battery for G-Class,"May 17, 2022"
Analysis,Analysis: Why Twitter has ignored Elon Musk's 'trolling',"May 17, 2022"
Markets,"S&P 500 ends lower as Tesla falls, while energy rallies","May 17, 2022"
Charged,"China regulator says Tesla recalling 107,293 China-made Model 3, Model Y vehicles","May 16, 2022"
Legal,Freshfields recruits deal lawyer from Wilson Sonsini in Silicon Valley,"May 16, 2022"
Technology,Musk says $44 billion Twitter deal on hold over fake account data,"May 16, 2022"
Charged,Tesla delays plan to restore Shanghai output to pre-lockdown levels,"May 16, 2022"
Markets,Elon Musk says Twitter legal team told him he violated an NDA,"May 15, 2022"
Charged,Indonesia's Jokowi meets Tesla's Musk after nickel talks,"May 15, 2022"
Markets,"Wall Street rallies, weekly losing streak continues","May 14, 2022"
Breakingviews,Breakingviews: Twitter brinkmanship favors Musk exit for a price,"May 13, 2022"
Technology,Quotes: Musk puts Twitter deal on hold,"May 13, 2022"
Business,Exclusive: Tesla puts India entry plan on hold after deadlock on tariffs,"May 13, 2022"
Charged,Nissan says it is too early to predict EV unit spin-off,"May 13, 2022"
World,Musk says he prefers 'less divisive' candidate than Trump in 2024,"May 13, 2022"
Charged,EV maker Canoo has 'substantial doubt' about going concern as cash runs low,"May 12, 2022"
Markets,Musk looks to scrap Tesla margin loan with new Twitter funding - Bloomberg Law,"May 12, 2022"
Autos & Transportation,"Renault says split-off electric unit could employ 10,000 staff by 2023","May 12, 2022"
Autos & Transportation,Volkswagen's EV profit margins to match combustion engines sooner than planned - CEO,"May 12, 2022"
